A1: OFFICIAL RESULTS | J1: CHENANGO COUNTY
J2: OFFICIAL RESULTS
J3: November 3, 2009 General Election
A5: LINCKLAEN | C5: REG. | D5: TOTAL | F5: TOWN | H5: COUNCILMAN
C6: VOTERS | D6: VOTED | F6: CLERK
F8: Jacpueline J. | H8: Dewey R. | I8: Barry N.
F9: RICE | H9: HAKES | I9: MONROE
F10: 4B | H10: 5B | I10: 6B
F11: Republican | H11: Republican | I11: Republican
A13: TOTAL | C13: 252 | D13: 63 | F13: 60 | H13: 63 | I13: 59
A16: MCDONOUGH | C16: REG. | D16: TOTAL | F16: SUPERVISOR | H16: TOWN | K16: COUNCILMAN | M16: SUPERINTENDENT
C17: VOTERS | D17: VOTED | H17: CLERK | M17: OF HIGHWAYS
F19: Arrington J. | H19: Donna M. | K19: Harvey W. | L19: John F. | M19: Lawrence H.
F20: CANOR | H20: PRESTON | K20: DEFOREST | L20: TRACY | M20: BECKWITH
A24: TOTAL | C24: 586 | D24: 114 | F24: 97 | H24: 107 | K24: 84 | L24: 92 | M24: 92
A27: NEW BERLIN | C27: REG. | D27: TOTAL | F27: SUPERVISOR | H27: COUNCILMAN
C28: VOTERS | D28: VOTED
F29: Ross | H29: Halys | I29: Robert
F30: IANNELLO | H30: DAVIS | I30: GARDNER
A32: DISTRICT 1 | C32: 761 | D32: 65 | F32: 51 | H32: 50 | I32: 43
A33: DISTRICT 2 | C33: 705 | D33: 80 | F33: 59 | H33: 71 | I33: 58
A35: TOTAL | C35: =SUM(C32:C33) -> 1466 | D35: =SUM(D32:D33) -> 145 | F35: =SUM(F32:F33) -> 110 | H35: =SUM(H32:H33) -> 121 | I35: =SUM(I32:I33) -> 101
A38: NORTH NORWICH | C38: REG. | D38: TOTAL | F38: SUPERVISOR | H38: TOWN | K38: COUNCILMAN | M38: SUPERINTENDENT
C39: VOTERS | D39: VOTED | H39: JUSTICE | M39: OF HIGHWAYS
F41: Richard B. | H41: Joseph M. | I41: Brian | K41: Robert E. | L41: Timothy P. | M41: Albert B.
F42: DECKER | H42: ELDRED | I42: SWIFT | K42: WANSOR | L42: JEFFREY | M42: ROUNDS
I43: WRITE-IN
A44: DISTRICT 1 | C44: 785 | D44: 104 | F44: 91 | H44: 91 | I44: 3 | K44: 89 | L44: 88 | M44: 93
A45: DISTRICT 2 | C45: 206 | D45: 21 | F45: 20 | H45: 16 | K45: 17 | L45: 17 | M45: 20
A47: TOTAL | C47: =SUM(C44:C45) -> 991 | D47: =SUM(D44:D45) -> 125 | F47: =SUM(F44:F45) -> 111 | H47: =SUM(H44:H45) -> 107 | I47: =SUM(I44:I45) -> 3 | K47: =SUM(K44:K45) -> 106 | L47: =SUM(L44:L45) -> 105 | M47: =SUM(M44:M45) -> 113