A2: CHENANGO COUNTY | F2: OFFICIAL ELECTION RESULTS
A4: GENERAL ELECTION NOVEMBER 2, 2010
A6: TOWN OF AFTON - JUSTICE
C8: 2010 REG | D8: Total | F8: Ronald A. | G8: WRITE-IN | H8: BLANKS | I8: VOID | J8: TOTAL
C9: VOTERS | D9: Votes | F9: Sherman
F10: Democratic
A11: TOWN OF AFTON
A12: AFTON 1 | C12: 688 | D12: 327 | F12: 226 | G12: 1 | H12: 100 | I12: 0 | J12: =SUM(F11:I11) -> 327
A13: AFTON 2 | C13: 896 | D13: 460 | F13: 328 | G13: 1 | H13: 131 | I13: 0 | J13: =SUM(F12:I12) -> 460
A15: TOTAL | C15: =SUM(C10:C12) -> 1584 | D15: =SUM(D10:D12) -> 787 | F15: =SUM(F10:F12) -> 554 | G15: =SUM(G10:G12) -> 2 | H15: =SUM(H10:H12) -> 231 | I15: =SUM(I10:I12) -> 0 | J15: =SUM(F14:I14) -> 787
F19: TOWN JUSTICE | G19: WRITE-IN | H19: BLANKS | I19: VOID | J19: TOTAL
C21: 2010 REG | D21: Total | F21: Randall W.
C22: VOTERS | D22: Votes | F22: LAMBRECHT
F23: Republican
A24: TOWN OF BAINBRIDGE
A25: BAINBRIDGE 1 | C25: 906 | D25: 458 | F25: 346 | G25: 0 | H25: 112 | I25: 0 | J25: =SUM(F25:I25) -> 458
A26: BAINBRIDGE 2 | C26: 1013 | D26: 562 | F26: 423 | G26: 2 | H26: 137 | I26: 0 | J26: =SUM(F26:I26) -> 562
A28: TOTAL | C28: =SUM(C24:C26) -> 1919 | D28: =SUM(D24:D26) -> 1020 | F28: =SUM(F24:F26) -> 769 | G28: =SUM(G24:G26) -> 2 | H28: =SUM(H24:H26) -> 249 | I28: =SUM(I24:I26) -> 0 | J28: =SUM(J24:J26) -> 1020
F32: COUNCILMAN | G32: WRITE-IN | H32: BLANKS | I32: VOID | J32: TOTAL
F33: (to fill vacancy)
C34: 2010 REG | D34: Total | F34: James A.
C35: VOTERS | D35: Votes | F35: MADDALONE
F36: Republican
A37: TOWN OF BAINBRIDGE
A38: BAINBRIDGE 1 | C38: 906 | D38: 458 | F38: 348 | G38: 0 | H38: 110 | I38: 0 | J38: =SUM(F38:I38) -> 458
A39: BAINBRIDGE 2 | C39: 1013 | D39: 562 | F39: 429 | G39: 2 | H39: 131 | I39: 0 | J39: =SUM(F39:I39) -> 562
A41: TOTAL | C41: =SUM(C37:C39) -> 1919 | D41: =SUM(D37:D39) -> 1020 | F41: =SUM(F37:F39) -> 777 | G41: =SUM(G37:G39) -> 2 | H41: =SUM(H37:H39) -> 241 | I41: =SUM(I37:I39) -> 0 | J41: =SUM(J37:J39) -> 1020
A45: TOWN OF COLUMBUS - SUPERVISOR
C47: 2010 REG | D47: Total | F47: Pamela J. | H47: Sara L. | I47: WRITE-IN | J47: BLANKS | K47: VOID | L47: TOTAL
C48: VOTERS | D48: Votes | F48: WEIDMAN | H48: PADDOCK
F49: Democrat | H49: Independence
A50: TOWN OF COLUMBUS
A51: COLUMBUS 1 | C51: 523 | D51: 259 | F51: 175 | H51: 55 | I51: 1 | J51: 28 | K51: 0 | L51: =SUM(F51:K51) -> 259
A53: TOTAL | C53: =SUM(C50:C52) -> 523 | F53: =SUM(F50:F52) -> 175 | H53: =SUM(H50:H52) -> 55 | I53: =SUM(I51:I52) -> 1 | J53: =SUM(J50:J52) -> 28 | K53: =SUM(K50:K52) -> 0 | L53: =SUM(L51) -> 259
A55: TOWN OF COVENTRY - JUSTICE
C57: 2010 REG | D57: Total | F57: Russell C. | G57: WRITE-IN | H57: BLANKS | I57: VOID | J57: TOTAL
C58: VOTERS | D58: Votes | F58: Lerwick
F59: Democratic
A60: TOWN OF COVENTRY
A61: COVENTRY 1 | C61: 937 | D61: 506 | F61: 330 | G61: 4 | H61: 171 | I61: 1 | J61: =SUM(F62:I62) -> 506
A63: TOTAL | C63: =SUM(C60:C62) -> 937 | D63: 506 | F63: 330 | G63: 4 | H63: 171 | I63: 1 | J63: =SUM(J62) -> 506
A65: TOWN OF GERMAN - COUNCILMAN
C67: 2010 REG | D67: Total | F67: Stella Penny | G67: Stella Penny | H67: WRITE-IN | I67: BLANKS | J67: VOID | K67: TOTAL
C68: VOTERS | D68: Votes | F68: LUM | G68: LUM
F69: Democratic | G69: Republican
A70: TOWN OF GERMAN
A71: GERMAN 1 | C71: 198 | D71: 111 | F71: 37 | G71: 64 | H71: 0 | I71: 10 | J71: 0 | K71: =SUM(F74:J74) -> 111
A73: TOTAL | C73: =SUM(C73:C75) -> 198 | D73: =SUM(D73:D75) -> 111 | F73: =SUM(F74:F75) -> 37 | G73: =SUM(G74:G75) -> 64 | H73: =SUM(H74:H75) -> 0 | I73: =SUM(I73:I75) -> 10 | J73: =SUM(J73:J75) -> 0 | K73: =SUM(F76:J76) -> 111
A75: TOWN OF GUILFORD - COUNCILMAN
C77: 2010 REG | D77: Total | F77: Michael G. | G77: Gary W. | H77: WRITE-IN | I77: BLANKS | J77: VOID | K77: TOTAL
C78: VOTERS | D78: Votes | F78: MILES | G78: SCHULTES
F79: Republcian | G79: Dairy
A80: TOWN OF GUILFORD
A81: GUILFORD 1 | C81: 711 | D81: 347 | F81: 151 | G81: 158 | H81: 0 | I81: 38 | J81: 0 | K81: =SUM(F86:J86) -> 347
A82: GUILFORD 2 | C82: 928 | D82: 508 | F82: 280 | G82: 152 | H82: 5 | I82: 71 | J82: 0 | K82: =SUM(F87:J87) -> 508
A84: TOTAL | C84: =SUM(C85:C87) -> 1639 | F84: =SUM(F85:F87) -> 431 | G84: =SUM(G85:G87) -> 310 | H84: =SUM(H87:H88) -> 5 | I84: =SUM(I85:I87) -> 109 | J84: =SUM(J85:J87) -> 0 | K84: =SUM(K86:K87) -> 855