A4: OFFICIAL RESULTS | E4: CHENANGO COUNTY
E5: TOWNS
A6: November 4, 2008 General Election | E6: OFFICIAL RESULTS
A8: ASSESSOR TO FILL VACANCY GERMAN
B9: TOTAL | C9: TOTAL | D9: LARRY E. | E9: SAMUEL D. | F9: BLANK | G9: VOID | H9: TOTAL
B10: REGISTERED | C10: VOTED | D10: JACOBS | E10: BERNIER
B11: VOTERS | D11: DEMOCRATIC | E11: REPUBLICAN
D12: 8A | E12: 8B
A13: GERMAN | B13: 213 | C13: 156 | D13: 69 | E13: 54 | F13: 33 | G13: 0 | H13: =SUM(D10:F10) -> 156
A15: TOTAL | B15: =SUM(B10:B10) -> 213 | C15: =SUM(C10:C10) -> 156 | D15: =SUM(D10:D10) -> 69 | E15: =SUM(E10:E10) -> 54 | F15: =SUM(F10:F10) -> 33 | G15: =SUM(G10:G10) -> 0 | H15: =SUM(H10:H10) -> 156
A17: TOWN JUSTICE GERMAN
B18: TOTAL | C18: TOTAL | D18: Pamela E. | E18: BLANK | F18: VOID | G18: TOTAL
B19: REGISTERED | C19: VOTED | D19: MARONEY
B20: VOTERS | D20: DEMOCRATIC
D21: 8A
A22: GERMAN | B22: 213 | C22: 156 | D22: 82 | E22: 74 | F22: 0 | G22: =SUM(D20:E20) -> 156
A24: TOTAL | B24: =SUM(B20:B20) -> 213 | C24: =SUM(C20:C20) -> 156 | D24: =SUM(D20:D20) -> 82 | E24: =SUM(E20:E20) -> 74 | F24: =SUM(F20:F20) -> 0 | G24: =SUM(G20:G20) -> 156
A26: TOWN JUSTICE GREENE
B27: TOTAL | C27: TOTAL | D27: ALTA R. | E27: BLANK | F27: VOID | G27: TOTAL
B28: REGISTERED | C28: VOTED | D28: MARTIN
B29: VOTERS | D29: SQUARE DEAL
A30: GREENE | D30: 7F
A31: DISTRICT 1 | B31: 683 | C31: 508 | D31: 223 | E31: 285 | F31: 0 | G31: =SUM(D30:E30) -> 508
A32: DISTRICT 2 | B32: 870 | C32: 663 | D32: 278 | E32: 385 | F32: 0 | G32: =SUM(D31:E31) -> 663
A33: DISTRICT 3 | B33: 993 | C33: 758 | D33: 282 | E33: 476 | F33: 0 | G33: =SUM(D32:E32) -> 758
A34: DISTRICT 4 | B34: 819 | C34: 621 | D34: 249 | E34: 372 | F34: 0 | G34: =SUM(D33:E33) -> 621
A36: TOTAL | B36: =SUM(B30:B33) -> 3365 | C36: =SUM(C30:C33) -> 2550 | D36: =SUM(D30:D33) -> 1032 | E36: =SUM(E30:E33) -> 1518 | F36: =SUM(F30:F30) -> 0 | G36: =SUM(G30:G33) -> 2550
A38: TOWN JUSTICE MCDONOUGH
B39: TOTAL | C39: TOTAL | D39: NELSON J. | E39: BLANK | F39: VOID | G39: TOTAL
B40: REGISTERED | C40: VOTED | D40: LUCIER
B41: VOTERS | D41: REPUBLICAN
D42: 7B
A43: MCDONOUGH | B43: 603 | C43: 434 | D43: 282 | E43: 152 | F43: 0 | G43: =SUM(D43:F43) -> 434
A45: TOTAL | B45: =SUM(B43:B43) -> 603 | C45: =SUM(C43:C43) -> 434 | D45: =SUM(D43:D43) -> 282 | E45: =SUM(E43:E43) -> 152 | F45: =SUM(F43:F43) -> 0 | G45: =SUM(G43:G43) -> 434
A48: ASSESSOR TO FILL VACANCY TOWN OF NORWICH
B49: TOTAL | C49: TOTAL | D49: MARK A. | E49: BLANK | F49: VOID | G49: TOTAL
B50: REGISTERED | C50: VOTED | D50: DOLIVER
B51: VOTERS | D51: REPUBLICAN
A52: NORWICH | D52: 7B
A53: DISTRICT 1 | B53: 790 | C53: 564 | D53: 334 | E53: 229 | F53: 1 | G53: =SUM(D53:F53) -> 564
A54: DISTRICT 2 | B54: 653 | C54: 498 | D54: 311 | E54: 186 | F54: 1 | G54: =SUM(D54:F54) -> 498
A55: DISTRICT 3 | B55: 903 | C55: 630 | D55: 378 | E55: 252 | F55: 0 | G55: =SUM(D55:F55) -> 630
A57: TOTAL | B57: =SUM(B53:B55) -> 2346 | C57: =SUM(C53:C55) -> 1692 | D57: =SUM(D53:D55) -> 1023 | E57: =SUM(E53:E53) -> 229 | F57: =SUM(F53:F53) -> 1 | G57: =SUM(G53:G55) -> 1692
A59: SUPERINTENDENT OF HIGHWAYS TO FILL VACANCY TOWN OF NORWICH
B60: TOTAL | C60: TOTAL | D60: MICHAEL P. | E60: BLANK | F60: VOID | G60: TOTAL
B61: REGISTERED | C61: VOTED | D61: GIBBON
B62: VOTERS | D62: REPUBLICAN
A63: NORWICH | D63: 8B
A64: DISTRICT 1 | B64: 790 | C64: 564 | D64: 352 | E64: 211 | F64: 1 | G64: =SUM(D65:F65) -> 564
A65: DISTRICT 2 | B65: 653 | C65: 498 | D65: 326 | E65: 171 | F65: 1 | G65: =SUM(D66:F66) -> 498
A66: DISTRICT 3 | B66: 903 | D66: 405 | E66: 225 | F66: 0 | G66: =SUM(D67:F67) -> 630
A68: TOTAL | B68: =SUM(B65:B67) -> 2346 | C68: =SUM(C65:C67) -> 1062 | D68: =SUM(D65:D67) -> 1083 | E68: =SUM(E65:E65) -> 211 | F68: =SUM(F65:F65) -> 1 | G68: =SUM(G65:G67) -> 1692
A70: COUNCILMAN TO FILL VACANCY PHARSALIA
D71: BRENDA L. | E71: BRENDA L. | F71: BLANK | G71: VOID | H71: TOTAL
B72: REGISTERED | C72: VOTED | D72: SMITH | E72: SMITH
B73: VOTERS | D73: DEMOCRATIC | E73: REPUBLICAN
D74: 7A | E74: 7B
A75: PHARSALIA | B75: 349 | C75: 253 | D75: 94 | E75: 99 | F75: 59 | G75: 1 | H75: =SUM(D77:G77) -> 253
A77: TOTAL | B77: =SUM(B77:B77) -> 349 | D77: =SUM(D77:D77) -> 94 | E77: =SUM(E77:E77) -> 99 | F77: =SUM(F77:F77) -> 59 | G77: =SUM(G77:G77) -> 1 | H77: =SUM(H77:H77) -> 253
A79: TOWN JUSTICE PLYMOUTH
B80: TOTAL | C80: TOTAL | D80: CAROLINA A. | E80: BLANK | F80: VOID | G80: TOTAL
B81: REGISTERED | C81: VOTED | D81: OCONNOR
B82: VOTERS | D82: WRITE-IN
D83: COL. 7
A84: PLYMOUTH | B84: 1044 | D84: 3 | E84: 0 | F84: 0 | G84: =SUM(D87:F87) -> 3
A86: TOTAL | B86: =SUM(B87:B87) -> 1044 | C86: =SUM(C87:C87) -> 0 | D86: =SUM(D87:D87) -> 3 | E86: =SUM(E87:E87) -> 0 | F86: =SUM(F87:F87) -> 0 | G86: =SUM(G87:G87) -> 3
A88: TOWN JUSTICE PRESTON
B89: TOTAL | C89: TOTAL | D89: THOMAS P. | E89: BLANK | F89: VOID | G89: TOTAL
B90: REGISTERED | C90: VOTED | D90: HOSFORD
B91: VOTERS | D91: REPUBLICAN
D92: 7B
A93: PRESTON | B93: 676 | C93: 458 | D93: 270 | E93: 188 | F93: 0 | G93: =SUM(D97:E97) -> 458
A95: TOTAL | B95: =SUM(B97:B97) -> 676 | C95: =SUM(C97:C97) -> 458 | D95: =SUM(D97:D97) -> 270 | E95: =SUM(E97:E97) -> 188 | F95: 0 | G95: =SUM(G97:G97) -> 458
A97: LIBRARY TRUSTEE (VOTE FOR TWO) SHERBURNE
B98: TOTAL | C98: TOTAL | D98: Lee | E98: Christine | F98: BLANK | G98: VOID | H98: TOTAL
B99: REGISTERED | C99: VOTED | D99: PERRIN | E99: HOFFMAN
B100: VOTERS | D100: WRITE-IN | E100: WRITE-IN
A101: SHERBURNE
A102: DISTRICT 1 | B102: 1076 | C102: 784 | D102: 0 | E102: 0 | F102: 0 | G102: 0 | H102: =SUM(D107:G107) -> 0
A103: DISTRICT 2 | B103: 397 | C103: 268 | D103: 1 | E103: 0 | H103: =SUM(D108:G108) -> 1
A104: DISTRICT 3 | B104: 758 | D104: 2 | E104: 2 | H104: =SUM(D109:G109) -> 4
A106: TOTAL | B106: =SUM(B107:B109) -> 2231 | C106: =SUM(C107:C107) -> 784 | D106: =SUM(D107:D109) -> 3 | E106: =SUM(E107:E109) -> 2 | F106: =SUM(F107:F109) -> 0 | G106: =SUM(G107:G109) -> 0 | H106: =SUM(H107:H109) -> 5