A1: OFFICIAL RESULTS | F1: CHENANGO COUNTY
F2: OFFICIAL RESULTS
F3: November 8, 2011 General Election
P4: SUPERINTENDENT
D5: SUPERVISOR | F5: TOWN CLERK | I5: COUNCILMAN | M5: ASSESSOR | P5: OF HIGHWAYS
D6: Richard C. | E6: Richard C. | F6: Ellen T. | G6: Ellen T. | H6: Stella Penny | I6: Steven F. | J6: Carol L. | K6: Carol L. | L6: Stephen J. | M6: Lisa A. | N6: Stephen J. | O6: Lisa A. | P6: Gerald R. | Q6: Gerald R.
A7: TOWNS | B7: REG. | C7: TOTAL | D7: SCHLAG | E7: SCHLAG | F7: MARONEY | G7: MARONEY | H7: LUM | I7: MARONEY | J7: TURSHMAN | K7: TURSHMAN | L7: COLLINS | M7: TEICHERT | N7: COLLINS | O7: TEICHERT | P7: TEMPLE | Q7: TEMPLE
A8: GERMAN | B8: VOTERS | C8: VOTED | D8: 2A | E8: 2B | F8: 2A | G8: 2B | H8: 4A | I8: 4B | J8: 5A | K8: 5B | L8: 6A | M8: 7A | N8: 6B | O8: 7B | P8: 8A | Q8: 8B
D9: Democratic | E9: Republcian | F9: Democratic | G9: Republican | H9: Democratic | I9: Republican | J9: Democratic | K9: Republican | L9: Democratic | M9: Republican | N9: Democratic | O9: Republican | P9: Democratic | Q9: Republican
A10: TOTAL | B10: 203 | C10: 62 | D10: 38 | E10: 22 | F10: 38 | G10: 22 | H10: 42 | I10: 35 | J10: 25 | K10: 20 | L10: 39 | M10: 33 | N10: 22 | O10: 21 | P10: 38 | Q10: 22
D12: SUPERVISOR | F12: TOWN CLERK | H12: JUSTICE | I12: COUNCILMAN
D13: Jack | E13: Deborah L. | F13: Deborah L. | G13: Colette C. | H13: Dante P. | I13: David C. | J13: Diane M.
A14: TOWN OF | B14: REG. | C14: TOTAL | D14: COOK | E14: THOMAS | F14: THOMAS | G14: SANDS | H14: ACUNTO | I14: YOUNG | J14: FLANAGAN
A15: GREENE | B15: VOTERS | C15: VOTED | D15: 2B | E15: 3B | F15: 3G | G15: 3H | H15: 4B | I15: 5B | J15: 6B
D16: Republican | E16: Republican | F16: Square Deal | G16: Have A Voice | H16: Republican | I16: Republican | J16: Republican
A17: DISTRICT 1 | B17: 699 | C17: 244 | D17: 197 | E17: 122 | F17: 18 | G17: 103 | H17: 168 | I17: 181 | J17: 186
A18: DISTRICT 2 | B18: 852 | C18: 290 | D18: 219 | E18: 162 | F18: 21 | G18: 106 | H18: 196 | I18: 377 | J18: 392
A19: DISTRICT 3 | B19: 991 | C19: 283 | D19: 223 | E19: 150 | F19: 25 | G19: 108 | H19: 199 | I19: 195 | J19: 216
A20: DISTRICT 4 | B20: 809 | C20: 304 | D20: 236 | E20: 156 | F20: 11 | G20: 134 | H20: 206 | I20: 208 | J20: 232
A21: TOTAL | B21: =SUM(B17:B20) -> 3351 | C21: =SUM(C17:C20) -> 1121 | D21: =SUM(D17:D20) -> 875 | E21: =SUM(E17:E20) -> 590 | F21: =SUM(F17:F20) -> 75 | G21: =SUM(G17:G20) -> 451 | H21: =SUM(H17:H20) -> 769 | I21: =SUM(I17:I20) -> 961 | J21: =SUM(J17:J20) -> 1026
D23: SUPERVISOR | E23: TOWN CLERK | H23: COUNCILMAN
D24: George J. | E24: Gail M. | F24: Corey C. | G24: Michael G. | H24: Joseph E. | I24: Christina M. | J24: Corey C.
A25: TOWN | B25: REG. | C25: TOTAL | D25: SENECK | E25: HOFFMAN | F25: MCELLIGOTT | G25: MILES | H25: ZACZEK | I25: TOWNSEND | J25: MCELLIGOTT
A26: GUILFORD | B26: VOTERS | C26: VOTED | D26: 2B | E26: 3B | F26: 4A | G26: 4B | H26: 5A | I26: 5B | J26: 4D
D27: Republcian | E27: Republican | F27: Democratic | G27: Republican | H27: Democratic | I27: Republican | J27: Working Families
A28: TOTAL | B28: 1642 | C28: 510 | D28: 359 | E28: 439 | F28: 146 | G28: 264 | H28: 239 | I28: 207 | J28: 34
D30: SUPERVISOR | E30: COUNCILMAN | G30: SUPERINTENDENT OF HIGHWAYS
D31: Wayne C. | E31: Patrick R. | F31: Steven A. | G31: Travis M. | H31: Rodney | I31: Jeffrey A.
A32: TOWN | B32: REG. | C32: TOTAL | D32: OUTWATER | E32: HOLL | F32: WARNER | G32: HULL | H32: LOSAW | I32: HATHWAY
B33: VOTERS | C33: VOTED | D33: 2B | E33: 3B | F33: 4B | G33: 5B | H33: 5G | I33: 5H
A34: LINCKLAEN | D34: Republcian | E34: Republican | F34: Republican | G34: Republican | H34: Square Deal | I34: Better Roads
A36: TOTAL | B36: 255 | C36: 151 | D36: 103 | E36: 115 | F36: 113 | G36: 76 | H36: 23 | I36: 47
D38: SUPERVISOR | F38: TOWN CLERK | G38: COUNCILMAN | L38: COUNCIL TO FILL VACANCY | N38: SUPERINTENDENT OF HIGHWAYS
D39: Homer D. | E39: Arrington J. | F39: Donna M. | G39: Harvey W. | H39: Leon K. | I39: Patricia E. | J39: Penny L. | K39: Lewis | L39: Terry C. | M39: Terry C. | N39: Ralph H. | O39: Ralph H.
A40: TOWN | B40: REG. | C40: TOTAL | D40: SMITH | E40: CANOR | F40: PRESTON | G40: DEFOREST | H40: BARROWS | I40: CLENDENING | J40: BECKWITH | K40: HUNGERFORD, JR. | L40: HARVEY | M40: HARVEY | N40: SICKLER | O40: SICKLER
B41: VOTERS | C41: VOTED | D41: 2A | E41: 2B | F41: 3B | G41: 4A | H41: 4B | I41: 5A | J41: 5B | K41: 4G | L41: 6A | M41: 6B | N41: 7A | O41: 7B
A42: MCDONOUGH | D42: Democratic | E42: Republcian | F42: Republican | G42: Democratic | H42: Republican | I42: Democratic | J42: Republican | K42: No Bull | L42: Democratic | M42: Republican | N42: Democratic | O42: Republican
A44: TOTAL | B44: 563 | C44: 293 | D44: 129 | E44: 160 | F44: 247 | G44: 92 | H44: 179 | I44: 124 | J44: 127 | K44: 36 | L44: 92 | M44: 156 | N44: 90 | O44: 148