A1: OFFICIAL RESULTS | K1: CHENANGO COUNTY
K2: OFFICIAL RESULTS
K3: November 3, 2009 General Election
A5: TOWN OF | C5: REG. | D5: TOTAL | F5: SUPERVISOR | G5: TOWN | H5: COUNCILMAN | J5: ASSESSOR | K5: SUPERINTENDENT | L5: TAX
A6: NORWICH | C6: VOTERS | D6: VOTED | G6: CLERK | K6: OF HIGHWAYS | L6: COLLECTOR
F8: David C. | G8: Martha L. | H8: Joanna | I8: Adam | J8: Mary C.E. | K8: Ronald G. | L8: Barbara E.
F9: LAW | G9: VIDLER | H9: CHIARINO | I9: EVANS | J9: MANLEY | K9: WHALEY | L9: ANNESI
A11: DISTRICT 1 | C11: 773 | D11: 115 | F11: 90 | G11: 89 | H11: 87 | I11: 91 | J11: 86 | K11: 88 | L11: 93
A12: DISTRICT 2 | C12: 632 | D12: 128 | F12: 101 | G12: 76 | H12: 73 | I12: 71 | J12: 100 | K12: 75 | L12: 80
A13: DISTRICT 3 | C13: 900 | D13: 104 | F13: 88 | G13: 90 | H13: 83 | I13: 86 | J13: 84 | K13: 84 | L13: 93
A15: TOTAL | C15: =SUM(C11:C13) -> 2305 | D15: =SUM(D11:D13) -> 347 | F15: =SUM(F11:F13) -> 279 | G15: =SUM(G11:G13) -> 255 | H15: =SUM(H11:H13) -> 243 | I15: =SUM(I11:I13) -> 248 | J15: =SUM(J11:J13) -> 270 | K15: =SUM(K11:K13) -> 247 | L15: =SUM(L11:L13) -> 266
A18: CITY OF NORWICH | C18: REG. | D18: TOTAL | F18: MAYOR | H18: SUPERVISOR | K18: SUPERVISOR | L18: ALDERMAN | M18: ALDERMAN | O18: ALKERMAN
C19: VOTERS | D19: VOTED | H19: WARD 1,2,3 | K19: WARD 4,5,6 | L19: WARD 2 | M19: WARD 4 | O19: WARD 6
F21: Joseph P. | G21: James J. | H21: Scott M. | I21: James J. | J21: Scott M. | K21: Linda E. | L21: Terry J. | M21: Walter P. | N21: Robert M. | O21: Robert M. | P21: Daniel J.
F22: MAIURANO | G22: MCNEIL | H22: SUTTON | I22: MCNEIL | J22: SUTTON | K22: NATOLI | L22: BRESINA | M22: SCHERMERHORN | N22: JEFFREY | O22: JEFFREY | P22: PALMER
A24: WARD 1 | C24: 724 | D24: 251 | F24: 144 | G24: 158 | H24: 86 | I24: 3 | J24: 4
A25: WARD 2 | C25: 641 | D25: 225 | F25: 148 | G25: 128 | H25: 78 | I25: 7 | J25: 7 | L25: 139
A26: WARD 3 | C26: 779 | D26: 342 | F26: 238 | G26: 174 | H26: 155 | I26: 6 | J26: 6
A27: WARD 4 | C27: 466 | D27: 86 | F27: 66 | K27: 67 | M27: 70
A28: WARD 5 | C28: 564 | D28: 93 | F28: 70 | K28: 73
A29: WARD 6 | C29: 602 | D29: 201 | F29: 154 | K29: 146 | N29: 155 | O29: 21 | P29: 19
A31: TOTAL | C31: =SUM(C24:C29) -> 3776 | D31: =SUM(D24:D29) -> 1198 | F31: =SUM(F24:F29) -> 820 | G31: =SUM(G24:G26) -> 460 | H31: =SUM(H24:H26) -> 319 | I31: =SUM(I24:I26) -> 16 | J31: =SUM(J24:J26) -> 17 | K31: =SUM(K27:K29) -> 286 | L31: 139 | M31: 70 | N31: 155 | O31: 21 | P31: 19
A34: OTSELIC | C34: REG. | D34: TOTAL | G34: SUPERVISOR | I34: TOWN | L34: COUNCILMAN
C35: VOTERS | D35: VOTED | I35: CLERK
J37: Virginia | K37: Calvin F. | L37: Michael | M37: Charles BJ | N37: Herbert W.
F38: David J. | G38: Stanley E. | H38: David J. | I38: Nika M. | J38: Ginnie | K38: HITE | L38: SHERIDAN | M38: BISHOP, JR. | N38: NEAL
F39: MESSINEO | G39: DAVIS | H39: MESSINEO | I39: COLE | J39: MACFARLAND
A41: TOTAL | C41: 601 | D41: 341 | F41: 159 | G41: 169 | H41: 11 | I41: 165 | J41: 165 | K41: 106 | L41: 97 | M41: 223 | N41: 214
A44: OXFORD | C44: REG. | D44: TOTAL | F44: SUPERVISOR | G44: TOWN | H44: COUNCILMAN
G45: CLERK
C46: VOTERS | D46: VOTED
F47: Lawrence N. | G47: James W. | H47: Larry A. | I47: John
F48: WILCOX | G48: HEMSTRAUGHT,JR. | H48: BECKWITH | I48: HOFMANN
A50: DISTRICT 1 | C50: 975 | D50: 149 | F50: 125 | G50: 107 | H50: 83 | I50: 106
A51: DISTRICT 2 | C51: 593 | D51: 60 | F51: 50 | G51: 54 | H51: 44 | I51: 41
A52: DISTRICT 3 | C52: 695 | D52: 79 | F52: 67 | G52: 65 | H52: 52 | I52: 64
A54: TOTAL | C54: =SUM(C50:C52) -> 2263 | D54: =SUM(D50:D52) -> 288 | F54: =SUM(F50:F52) -> 242 | G54: =SUM(G50:G52) -> 226 | H54: =SUM(H50:H52) -> 179 | I54: =SUM(I50:I52) -> 211