A1: OFFICIAL RESULTS | G1: CHENANGO COUNTY
G2: OFFICIAL RESULTS
A3: November 6, 2012 General Election
A6: TOWNS | H6: COUNCILMAN (To Fill Vacancy 1 Year Term)
B7: TOTAL | D7: TOTAL | F7: April M. | H7: Robert G. | J7: April M. | L7: WRITE-INS | N7: BLANKS | O7: VOIDS | P7: TOTAL
B8: REGISTERED | D8: VOTED | F8: LEGGETT | H8: TALLMADGE | J8: LEGGETT
A9: AFTON | B9: VOTERS | F9: Democratic | H9: Republican | J9: Vision for Afton
F10: 8A | H10: 8B | J10: 8G
A12: TOTAL | B12: 1594 | D12: 1067 | F12: 341 | H12: 661 | J12: 21 | L12: 1 | N12: 43 | O12: 0 | P12: =SUM(F12:O12) -> 1067
H15: COUNCILMAN (To Fill Vacancy 3 Year Term)
A16: BAINBRIDGE | B16: TOTAL | D16: TOTAL | F16: David A. | H16: Jonathan | L16: WRITE-INS | N16: BLANKS | O16: VOIDS | P16: TOTAL
B17: REGISTERED | D17: VOTED | F17: DECLUE | H17: PRATT
B18: VOTERS | F18: Republican | H18: Working Together
F19: 8B | H19: 8G
A21: TOTAL | B21: 1906 | D21: 1260 | F21: 785 | H21: 302 | L21: 4 | N21: 169 | O21: 0 | P21: =SUM(F21:O21) -> 1260
H24: ASSESSOR (To Fill Vacancy 1 Year Term)
A25: GERMAN | B25: TOTAL | D25: TOTAL | H25: (Write-In)
B26: REGISTERED | D26: VOTED | L26: WRITE-INS
B27: VOTERS | H27: Jenny Jack
A29: TOTAL | B29: 204 | H29: 3 | L29: 3
F32: TOWN JUSTICE
A33: GREENE | B33: TOTAL | D33: TOTAL | F33: Alta R. | L33: WRITE-INS | N33: BLANKS | O33: VOIDS | P33: TOTAL
B34: REGISTERED | D34: VOTED | F34: MARTIN
B35: VOTERS | F35: Republican
F36: 8B
A37: DISTRICT 1 | B37: 1356 | D37: 921 | F37: 743 | L37: 1 | N37: 176 | O37: 1 | P37: =SUM(F37:O37) -> 921
A38: DISTRICT 2 | B38: 2032 | D38: 1423 | F38: 1113 | L38: 3 | N38: 307 | O38: 0 | P38: =SUM(F38:O38) -> 1423
A40: TOTAL | B40: =SUM(B37:B38) -> 3388 | D40: =SUM(D37:D38) -> 2344 | F40: =SUM(F37:F38) -> 1856 | L40: =SUM(L37:L38) -> 4 | N40: =SUM(N37:N38) -> 483 | O40: =SUM(O37:O38) -> 1 | P40: =SUM(P37:P38) -> 2344
F42: TOWN CLERK (To Fill Vacancy 1 Year Term)
A43: LINCKLAEN | B43: TOTAL | D43: TOTAL | F43: Mahaley M. | L43: WRITE-INS | N43: BLANKS | O43: VOIDS | P43: TOTAL
B44: REGISTERED | D44: VOTED | F44: HOLL
B45: VOTERS | F45: Republican
F46: 8B
A47: TOTAL | B47: 252 | F47: 148 | L47: 1 | N47: 26 | O47: 0 | P47: =SUM(F48:O48) -> 175
F50: TOWN JUSTICE
F51: Nelson J. | H51: WRITE-INS | J51: BLANKS | L51: VOIDS | N51: TOTAL
A52: MCDONOUGH | B52: TOTAL | D52: TOTAL | F52: LUCIER
B53: REGISTERED | D53: VOTED | F53: Republican
B54: VOTERS | F54: 8B
A56: TOTAL | B56: 571 | D56: 391 | F56: 317 | H56: 0 | J56: 73 | L56: 1 | N56: =SUM(F58:L58) -> 391
B58: TOTAL | F58: SUPERINTENDENT
B59: VOTED | F59: OF HIGHWAYS
F60: (To fill Vacancy 1 Year Term)
F61: Thomas L.
F62: HAAS
F63: Republican
F64: 9B
B66: 391 | F66: 298 | H66: 4 | J66: 88 | L66: 1 | N66: =SUM(F68:L68) -> 391
F69: TOWN CLERK (TO Fill Vacancy 3 Year Term)
F70: Bonnie Jean | L70: WRITE-INS | N70: BLANKS | O70: VOIDS | P70: TOTAL
A71: NEW BERLIN | B71: TOTAL | D71: TOTAL | F71: BAUER
B72: REGISTERED | D72: VOTED | F72: Republican
B73: VOTERS | F73: 8B
A75: TOTAL | B75: 1410 | D75: 901 | F75: 644 | L75: 8 | N75: 248 | O75: 1 | P75: =SUM(F79:O79) -> 901
F78: COUNCILMAN (to Fill Vacancy 1 Year Term)
F79: Dean R. | L79: WRITE-INS | N79: BLANKS | O79: VOIDS | P79: TOTAL
A80: NORTH NORWICH | B80: TOTAL | D80: TOTAL | F80: EDWARDS
B81: REGISTERED | D81: VOTED | F81: Republican
B82: VOTERS | F82: 8B
A84: TOTAL | B84: 999 | D84: 665 | F84: 466 | L84: 0 | N84: 199 | O84: 0 | P84: =SUM(F88:O88) -> 665
F86: COUNCILMAN (to Fill Vacancy 1 Year Term)
F87: Stanley D. | H87: Michael T. | L87: WRITE-INS | N87: BLANKS | O87: VOIDS | P87: TOTAL
A88: TOWN OF NORWICH | B88: TOTAL | D88: TOTAL | F88: FOULDS | H88: FORD
B89: REGISTERED | D89: VOTED | F89: Republican | H89: Voice of the People
B90: VOTERS | F90: 8B | H90: 8G
A91: District 1 | B91: 1149 | D91: 785 | F91: 528 | H91: 159 | L91: 0 | N91: 98 | O91: 0 | P91: =SUM(F96:O96) -> 785
A92: District 2 | B92: 1093 | D92: 753 | F92: 451 | H92: 184 | L92: 1 | N92: 117 | O92: 0 | P92: =SUM(F97:O97) -> 753
A94: TOTAL | B94: =SUM(B96:B97) -> 2242 | D94: =SUM(D96:D97) -> 1538 | F94: =SUM(F96:F97) -> 979 | H94: =SUM(H96:H97) -> 343 | L94: =SUM(L96:L97) -> 1 | N94: =SUM(N96:N97) -> 215 | O94: =SUM(O96:O97) -> 0 | P94: =SUM(P96:P97) -> 1538
F97: ALDERMAN WARD 1 (To Fill Vacancy 3 Year Term)
A98: CITY OF NORWICH | F98: Bryan | L98: WRITE-INS | N98: BLANKS | O98: VOIDS | P98: TOTAL
B99: TOTAL | D99: TOTAL | F99: MCCRACKEN
A100: WARD 1 | B100: REGISTERED | D100: VOTED | F100: Square Deal
B101: VOTERS | F101: 8G
A103: TOTAL | B103: 706 | D103: 511 | F103: 219 | L103: 4 | N103: 288 | O103: 0 | P103: =SUM(F108:O108) -> 511
F105: ALDERMAN WARD 1 (To Fill Vacancy 3 Year Term)
F106: Daniel J. | H106: Daniel J. | L106: WRITE-INS | N106: BLANKS | O106: VOIDS | P106: TOTAL
B107: TOTAL | D107: TOTAL | F107: PALMER | H107: PALMER
A108: WARD 6 | B108: REGISTERED | D108: VOTED | F108: Republican | H108: Common Sense
B109: VOTERS | F109: 8B | H109: 8G
A111: TOTAL | B111: 596 | D111: 435 | F111: 298 | H111: 20 | L111: 8 | N111: 109 | O111: 0 | P111: =SUM(F117:O117) -> 435
F114: TOWN JUSTICE
F115: Thomas P. | L115: WRITE-INS | N115: BLANKS | O115: VOIDS | P115: TOTAL
A116: PRESTON | B116: TOTAL | D116: TOTAL | F116: HOSFORD
B117: REGISTERED | D117: VOTED | F117: Republican
B118: VOTERS | F118: 8B
A120: TOTAL | B120: 656 | D120: 420 | F120: 316 | L120: 0 | N120: 104 | O120: 0 | P120: =SUM(F126:O126) -> 420
F123: TOWN JUSTICE | H123: COUNCILMAN (to Fill Vacancy 1 Year Term)
H125: Daniel W. | J125: Karl R. | L125: WRITE-INS | N125: BLANKS | O125: VOIDS | P125: TOTAL
A126: SMITHVILLE | B126: TOTAL | D126: TOTAL | F126: WRITE-IN | H126: HAYES | J126: LUDWIG
B127: REGISTERED | D127: VOTED | H127: Democratic | J127: Republican
B128: VOTERS | H128: 9A | J128: 9B
A130: TOTAL | B130: 797 | D130: 543 | F130: 126 | H130: 230 | J130: 285 | L130: 2 | N130: 26 | O130: 0 | P130: =SUM(H135:O136) -> 543
J132: SUPERVISOR (to Fill Vacancy 1 Year Term)
F134: Michael R. | H134: Michael R. | J134: Gerald E. | L134: Michael R. | N134: John | O134: WRITE-INS | P134: BLANKS | Q134: VOIDS | R134: TOTAL
A135: SMYRNA | B135: TOTAL | D135: TOTAL | F135: KHOURY | H135: KHOURY | J135: PARRY, SR. | L135: KHOURY | N135: GROSSO
B136: REGISTERED | D136: VOTED | F136: Democratic | H136: Republican | J136: Your Choice | L136: We the People | N136: Square Deal
B137: VOTERS | F137: 8A | H137: 8B | J137: 8G | L137: 8H | N137: 8I
A139: TOTAL | B139: 757 | D139: 514 | F139: 174 | H139: 202 | J139: 74 | L139: 20 | N139: 33 | O139: 0 | P139: 11 | Q139: 0 | R139: =SUM(F146:Q146) -> 514