A1: OFFICIAL RESULTS | J1: CHENANGO COUNTY
J2: OFFICIAL RESULTS
J3: November 3, 2009 General Election
A5: SHERBURNE | B5: REG. | C5: TOTAL | E5: SUPERVISOR | F5: TOWN | G5: TOWN | K5: COUNCILMAN | M5: SUPERINTENDENT | N5: LIBRARY
B6: VOTERS | C6: VOTED | F6: CLERK | G6: JUSTICE | M6: OF HIGHWAYS | N6: TRUSTEE
E8: William C. | F8: Kathy S. | G8: James W. | H8: John R. | J8: Charles A. | K8: Edwin T. | L8: Stephen C. | M8: Robert H. | N8: Daniel G.
E9: CRAINE | F9: MCDANIEL | G9: PEPTIS | H9: POWELL | J9: MASTRO | K9: MEYER | L9: MCCARTY | M9: BRUNSCHMID | N9: BENSLEY
E10: Republican | F10: Republican | G10: Republican | H10: Republican | J10: Republican | K10: Republican | L10: Open Door | M10: Republican | N10: Square Deal
E11: 4B | F11: 5B | G11: 6B | H11: 7B | J11: 8B | K11: 9B | L11: 8F | M11: 10B | N11: 11G
A13: DISTRICT 1 | B13: 1077 | C13: 206 | E13: 173 | F13: 189 | G13: 175 | H13: 156 | J13: 163 | K13: 111 | L13: 85 | M13: 177 | N13: 140
A14: DISTRICT 2 | B14: 393 | C14: 75 | E14: 61 | F14: 62 | G14: 62 | H14: 55 | J14: 52 | K14: 48 | L14: 18 | M14: 61 | N14: 45
A15: DISTRICT 3 | B15: 793 | C15: 211 | E15: 181 | F15: 183 | G15: 166 | H15: 153 | J15: 138 | K15: 112 | L15: 113 | M15: 181 | N15: 141
A17: TOTAL | B17: =SUM(B13:B15) -> 2263 | C17: =SUM(C13:C15) -> 492 | E17: =SUM(E13:E15) -> 415 | F17: =SUM(F13:F15) -> 434 | G17: =SUM(G13:G15) -> 403 | H17: =SUM(H13:H15) -> 364 | J17: =SUM(J13:J15) -> 353 | K17: =SUM(K13:K15) -> 271 | L17: =SUM(L13:L15) -> 216 | M17: =SUM(M13:M15) -> 419 | N17: =SUM(N13:N15) -> 326
A20: SMITHVILLE | B20: REG. | C20: TOTAL | E20: SUPERVISOR | G20: TOWN | J20: TOWN | N20: COUNCILMAN | S20: COUNCILMAN | V20: SUPERINTENDENT
B21: VOTERS | C21: VOTED | G21: CLERK | J21: JUSTICE | S21: TO FILL VACANCY | V21: OF HIGHWAYS
E23: Daniel W. | F23: Allan I. | G23: Alison B. | H23: Alison B. | J23: Bruce | L23: Elizabeth A. | M23: Michael W. | N23: Victor H. | O23: Charles J. | P23: John J. | Q23: Elizabeth A. | S23: Holly A. | T23: Barbara Ann L. | V23: Bruce G.
E24: HAYES | F24: JOHNSON | G24: OWENS | H24: OWENS | J24: BRAMAN | L24: VANDERWEYDE | M24: HUFF | N24: HAMMOND | O24: SCHULTES | P24: CAMMARATA | Q24: VANDERWEYDE | S24: MOHR | T24: WHITMORE | V24: KINNEY
E25: Democratic | F25: Republican | G25: Republican | H25: Choice and Freedom | J25: Scales of Justice | L25: Democratic | M25: Democratic | N25: Republican | O25: Republican | P25: Farmland | Q25: Voice of the People | S25: Another Choice | T25: Open Door | V25: Democratic
E26: 4A | F26: 4b | G26: 5B | H26: 5F | J26: 6G | L26: 7A | M26: 8A | N26: 7B | O26: 8B | P26: 7H | Q26: 7I | S26: 9H | T26: 9I | V26: 10A
A28: DISTRICT 1 | B28: 313 | C28: 94 | E28: 26 | F28: 65 | G28: 78 | H28: 2 | J28: 33 | L28: 27 | M28: 21 | N28: 37 | O28: 54 | P28: 27 | Q28: 4 | S28: 58 | T28: 12 | V28: 71
A29: DISTRICT 2 | B29: 480 | C29: 217 | E29: 111 | F29: 100 | G29: 158 | H29: 19 | J29: 102 | L29: 86 | M29: 60 | N29: 71 | O29: 120 | P29: 58 | Q29: 8 | S29: 127 | T29: 50 | V29: 172
A31: TOTAL | B31: =SUM(B28:B29) -> 793 | C31: =SUM(C28:C29) -> 311 | E31: =SUM(E28:E29) -> 137 | F31: =SUM(F28:F29) -> 165 | G31: =SUM(G28:G29) -> 236 | H31: =SUM(H28:H29) -> 21 | J31: =SUM(J28:J29) -> 135 | L31: =SUM(L28:L29) -> 113 | M31: =SUM(M28:M29) -> 81 | N31: =SUM(N28:N29) -> 108 | O31: =SUM(O28:O29) -> 174 | P31: =SUM(P28:P29) -> 85 | Q31: =SUM(Q28:Q29) -> 12 | S31: =SUM(S28:S29) -> 185 | T31: =SUM(T28:T29) -> 62 | V31: =SUM(V28:V29) -> 243
A34: SMYRNA | B34: REG. | C34: TOTAL | F34: SUPERVISOR | H34: TOWN | K34: COUNCILMAN | N34: SUPERINTENDENT
B35: VOTERS | C35: VOTED | H35: CLERK | N35: OF HIGHWAYS
E37: James B. | F37: Gerald E. | G37: Gerald E. | H37: Geraldine W. | J37: Stephen K. | K37: Robert L. | L37: Mark E. | M37: Daniel R. | N37: Gary R.
E38: BAYS | F38: PERRY, SR. | G38: PERRY, SR. | H38: DAY | J38: CAMPBELL | K38: MATTESON | L38: SWAYZE | M38: WHITEHEAD | N38: GRAHAM
E39: Democratic | F39: Republcian | G39: Square Deal | H39: Republican | J39: Democratic | K39: Republican | L39: Democratic | M39: Republican | N39: Republican
E40: 4A | F40: 4B | G40: 4F | H40: 5B | J40: 6A | K40: 6B | L40: 7A | M40: 7B | N40: 8B
A42: TOTAL | B42: 734 | C42: 328 | E42: 205 | F42: 117 | G42: 4 | H42: 262 | J42: 125 | K42: 159 | L42: 172 | M42: 158 | N42: 243