A1: OFFICIAL RESULTS | F1: CHENANGO COUNTY
F2: OFFICIAL RESULTS
F3: November 8, 2011 General Election
J5: SUPERINTENDENT
D6: SUPERVISOR | E6: TOWN CLERK | G6: COUNCILMAN | H6: COUNCILMAN | J6: OF HIGHWAYS
D7: Peter C. | E7: Deanna J. | F7: V. Peter VR | G7: David L. | H7: Geraldine E. | I7: Stacie P. | J7: Charles K.
A8: TOWN | B8: REG. | C8: TOTAL | D8: FLANAGAN | E8: JOHNSON | F8: MASON | G8: DUNCKEL | H8: BARNES | I8: EDICK | J8: STEIN, SR.
A9: PRESTON | B9: VOTERS | C9: VOTED | D9: 2A | E9: 3B | F9: 4A | G9: 4B | H9: 5A | I9: 4F | J9: 6B
D10: Democratic | E10: Republican | F10: Democratic | G10: Republican | H10: Democratic | I10: Green | J10: Republican
A12: TOTAL | B12: 664 | C12: 150 | D12: 125 | E12: 126 | F12: 91 | G12: 100 | H12: 61 | I12: 22 | J12: 118
D14: SUPERVISOR | E14: COUNCILMAN | G14: COUNCIL TO FILL VACANCY | I14: LIBRARY TRUSTEE | K14: LIBRARY TRUSTEE
D15: Charles A. | E15: Glen C. | F15: Rowena R. | G15: David L. | H15: Wm. Charles | I15: 2 YR TERM | K15: TO FILL VACANCY
A16: TOWN | B16: REG. | C16: TOTAL | D16: MASTRO | E16: BAGNALL | F16: KRUM | G16: WERN | H16: SCHLERNITZAUER | I16: Write-ins | K16: Write-ins
A17: SHERBURNE | B17: VOTERS | C17: VOTED | D17: 2B | E17: 2B | F17: 4B | G17: 5B | H17: 4B | I17: Lynn H. Morris | J17: 92 | K17: Lynn H. Morris | L17: 9
D18: Republican | E18: Republican | F18: Republican | G18: Republcian | H18: Independence | I18: William Y. W. Au | J18: 74 | K18: William Y. W. Au | L18: 19
A19: DISTRICT 1 | B19: 1087 | C19: 139 | D19: 121 | E19: 121 | F19: 109 | G19: 92 | H19: 39 | I19: Kathleen M. Yasas | J19: 42 | K19: Kathleen M. Yasas | L19: 48
A20: DISTRICT 2 | B20: 388 | C20: 32 | D20: 26 | E20: 29 | F20: 24 | G20: 18 | H20: 14
A21: DISTRICT 3 | B21: 802 | C21: 165 | D21: 143 | E21: 143 | F21: 124 | G21: 116 | H21: 40
A22: TOTAL | B22: =SUM(B19:B21) -> 2277 | C22: =SUM(C19:C21) -> 336 | D22: =SUM(D19:D21) -> 290 | E22: =SUM(E19:E21) -> 293 | F22: =SUM(F19:F21) -> 257 | G22: =SUM(G19:G21) -> 226 | H22: =SUM(H19:H21) -> 93
E24: SUPERVISOR | G24: TOWN CLERK | H24: JUSTICE | K24: COUNCILMAN | O24: SUPERINTENDENT | P24: OF HIGHWAYS
D25: Fred J. | E25: Fred J. | F25: Roger J. | G25: Alison B. | H25: Benjamin D. | I25: Kenneth P. | J25: Robert M. | K25: Barbara Ann L. | L25: John J. | M25: Carol | N25: Dennis M. | O25: Charles Jay | P25: Bruce G. | Q25: Dennis M.
A26: TOWN | B26: REG. | C26: TOTAL | D26: HEISLER, JR | E26: HEISLER, JR. | F26: CONNELLY | G26: OWENS | H26: KEHL | I26: WHITMORE, JR. | J26: WHITMORE | K26: WHITMORE | L26: CAMMARATA | M26: OMALYEV | N26: SMITH | O26: SCHULTES, JR | P26: KINNEY | Q26: SMITH
A27: SMITHVILLE | B27: VOTERS | C27: VOTED | D27: 2B | E27: 2C | F27: 2G | G27: 3B | H27: 4B | I27: 5A | J27: 5B | K27: 6A | L27: 6B | M27: 5F | N27: 7A | O27: 7B | P27: 7H | Q27: 7I
D28: Republican | E28: Conservative | F28: Common Sense | G28: Republican | H28: Republican | I28: Democratic | J28: Republican | K28: Democratic | L28: Republican | M28: Green | N28: Democratic | O28: Republican | P28: Square Deal | Q28: People 4 Progress
A30: TOTAL | B30: 795 | C30: 395 | D30: 182 | E30: 27 | F30: 177 | G30: 356 | H30: 319 | I30: 131 | J30: 232 | K30: 79 | L30: 199 | M30: 99 | N30: 26 | O30: 129 | P30: 233 | Q30: 2
M32: SUPERINTENDENT
E33: SUPERVISOR | G33: TOWN CLERK | H33: JUSTICE | K33: COUNCILMAN | M33: OF HIGHWAYS
D34: James B. | E34: John | F34: John | G34: Geraldine W. | H34: Gerrard J. | I34: Wayne C. | J34: Wayne C. | K34: Ernest F. | L34: Robert R. | M34: Robert D.
A35: TOWN | B35: REG. | C35: TOTAL | D35: BAYS | E35: GROSSO | F35: GROSSO | G35: DAY | H35: BURRS | I35: SIMMONS | J35: SIMMONS | K35: SCHRAFT, JR | L35: GRAHAM | M35: GRAHAM
A36: SMYRNA | B36: VOTERS | C36: VOTED | D36: 2A | E36: 2B | F36: 2G | G36: 3B | H36: 4B | I36: 5A | J36: 5B | K36: 6A | L36: 7A | M36: 7A
D37: Democratic | E37: Republican | F37: Square Deal | G37: Republican | H37: Republican | I37: Democratic | J37: Republican | K37: Democratic | L37: Democratic | M37: Democratic
A39: TOTAL | B39: 737 | C39: 307 | D39: 197 | E39: 88 | F39: 5 | G39: 269 | H39: 230 | I39: 122 | J39: 134 | K39: 172 | L39: 131 | M39: 254