A1: OFFICIAL RESULTS | J1: CHENANGO COUNTY
J2: OFFICIAL RESULTS
J3: November 3, 2009 General Election
W4: SUPERINTENDENT
A5: COVENTRY | C5: REG. | D5: TOTAL | H5: SUPERVISOR | P5: COUNCILMAN | W5: OF HIGHWAYS
C6: VOTERS | D6: VOTED
F7: Janice A. | G7: John M. | H7: Larry G. | I7: Janice A. | J7: John M. | M7: Phyllis S. | N7: John B. | O7: Robert E. | P7: George | Q7: Patricia D. | R7: Phyllis S. | S7: John B. | T7: Robert E. | V7: Richard M. | W7: Richard M. | X7: Rodney S.
F8: O'SHEA | G8: PHELAN, SR. | H8: CLARK | I8: O'SHEA | J8: PHELAN, SR. | M8: LERWICK | N8: SANFORD | O8: BOUDREAU | P8: BROEG | Q8: FISKE | R8: LERWICK | S8: SANFORD | T8: BOUDREAU | V8: GRANGER, JR. | W8: GRANGER, JR. | X8: BOLSTER
F9: 4A | G9: 4B | H9: 4C | I9: 4F | J9: 4G | M9: 5A | N9: 6A | O9: 5B | P9: 6B | Q9: 5D | R9: 5F | S9: 6F | T9: 5G | V9: 7A | W9: 7B | X9: 7H
F10: Democratic | G10: Republican | H10: Independence | I10: For Coventry | J10: Liberty | M10: Democratic | N10: Democratic | O10: Republican | P10: Republican | Q10: Conservative | R10: For Coventry | S10: For Coventry | T10: Liberty | V10: Democratic | W10: Republican | X10: Safer Highways
A12: TOTAL | C12: 928 | D12: 593 | F12: 170 | G12: 302 | H12: 70 | I12: 23 | J12: 21 | M12: 167 | N12: 180 | O12: 313 | P12: 308 | Q12: 113 | R12: 25 | S12: 33 | T12: 14 | V12: 175 | W12: 198 | X12: 205
A15: GERMAN | C15: REG. | D15: TOTAL | F15: SUPERVISOR | H15: TOWN | J15: TOWN | O15: COUNCILMAN | Q15: ASSESSOR | S15: SUPERINTENDENT
C16: VOTERS | D16: VOTED | H16: CLERK | J16: JUSTICE | S16: OF HIGHWAYS
F18: Richard C. | G18: Richard C. | H18: Ellen T. | I18: Ellen T. | J18: Dennis W. | N18: Donald C. | O18: Patricia L. | P18: Donald C. | Q18: Larry | S18: Gerald R. | T18: Gerald R.
F19: SCHLAG | G19: SCHLAG | H19: MARONEY | I19: MARONEY | J19: CARTER | N19: NOGVA | O19: PITTSLEY | P19: NOGVA | Q19: JACOBS | S19: TEMPLE | T19: TEMPLE
F20: 4A | G20: 4B | H20: 5A | I20: 5B | J20: 6B | N20: 7A | O20: 8A | P20: 7B | Q20: WRITE-IN | S20: 10A | T20: 10B
F21: Democratic | G21: Republican | H21: Democratic | I21: Republican | J21: Republican | N21: Democratic | O21: Democratic | P21: Republican | S21: Democratic | T21: Republican
A23: TOTAL | C23: 202 | D23: 58 | F23: 30 | G23: 28 | H23: 28 | I23: 27 | J23: 41 | N23: 28 | O23: 29 | P23: 47 | Q23: 1 | S23: 31 | T23: 26
A26: GREENE | C26: REG. | D26: TOTAL | F26: SUPERVISOR | I26: COUNCILMAN
C27: VOTERS | D27: VOTED
F28: Jack T. | G28: Stephen L. | H28: Joseph M. | I28: Joshua P. | J28: Michael C.
F29: COOK | G29: PAGE | H29: HENNINGE | I29: BROWNING | J29: FLANAGAN
A31: DISTRICT 1 | C31: 681 | D31: 167 | F31: 138 | G31: 88 | H31: 115 | I31: 82 | J31: 20
A32: DISTRICT 2 | C32: 861 | D32: 206 | F32: 144 | G32: 127 | H32: 110 | I32: 88 | J32: 41
A33: DISTRICT 3 | C33: 986 | D33: 227 | F33: 165 | G33: 115 | H33: 132 | I33: 115 | J33: 46
A34: DISTRICT 4 | C34: 811 | D34: 265 | F34: 204 | G34: 150 | H34: 162 | I34: 120 | J34: 47
A36: TOTAL | C36: =SUM(C31:C34) -> 3339 | D36: =SUM(D31:D34) -> 865 | F36: =SUM(F31:F34) -> 651 | G36: =SUM(G31:G34) -> 480 | H36: =SUM(H31:H34) -> 519 | I36: =SUM(I31:I34) -> 405 | J36: =SUM(J31:J34) -> 154
A39: GUILFORD | C39: REG. | D39: TOTAL | F39: SUPERVISOR | H39: TOWN | J39: TOWN | O39: COUNCILMAN
C40: VOTERS | D40: VOTED | H40: CLERK | J40: JUSTICE
F42: George J. | G42: Dennis E. | H42: Gail M. | I42: David P. | J42: Joan M. | K42: Michael | M42: Dolores L. | N42: Richard E. | O42: Thomas C. | P42: Russell J. | Q42: Celeste
F43: SENECK | G43: MARTIN | H43: HOFFMAN | I43: DANIELS | J43: KLINE | K43: ALGIERE | M43: FULLER | N43: MACKAY | O43: IVES | P43: HEATH | Q43: ABER
K44: WRITE-IN
A45: DISTRICT 1 | C45: 710 | D45: 219 | F45: 142 | G45: 70 | H45: 168 | I45: 166 | J45: 157 | K45: 6 | M45: 108 | N45: 51 | O45: 124 | P45: 85 | Q45: 39
A46: DISTRICT 2 | C46: 921 | D46: 306 | F46: 198 | G46: 93 | H46: 270 | I46: 258 | J46: 248 | K46: 7 | M46: 122 | N46: 71 | O46: 206 | P46: 142 | Q46: 43
A48: TOTAL | C48: =SUM(C43:C46) -> 1631 | D48: =SUM(D43:D46) -> 525 | F48: =SUM(F43:F46) -> 340 | G48: =SUM(G43:G46) -> 163 | H48: =SUM(H43:H46) -> 438 | I48: =SUM(I43:I46) -> 424 | J48: =SUM(J43:J46) -> 405 | K48: =SUM(K43:K46) -> 13 | M48: =SUM(M43:M46) -> 230 | N48: =SUM(N43:N46) -> 122 | O48: =SUM(O43:O46) -> 330 | P48: =SUM(P43:P46) -> 227 | Q48: =SUM(Q43:Q46) -> 82