A1: OFFICIAL RESULTS | L1: CHENANGO COUNTY
L2: OFFICIAL RESULTS
L3: November 3, 2009 General Election
A5: AFTON | C5: REG. | D5: TOTAL | E5: SUPERVISOR | G5: TOWN | J5: TOWN | M5: COUNCILMAN | P5: SUPERINTENDENT
C6: VOTERS | D6: VOTED | G6: CLERK | J6: JUSTICE | P6: OF HIGHWAYS
E8: Robert D. | G8: Pamela J. | H8: Rosemarie A. | J8: Joseph C. | L8: Robert G. | M8: John H. | N8: Mary Jo | P8: Lynn C.
E9: BRIGGS | G9: WYLUBSKI | H9: KLATZ | J9: PALUMBO | L9: TALLMADGE | M9: LAWRENCE | N9: LONG | P9: SCHULTIS
E10: 4B | G10: 5F | H10: 5G | J10: 6B | L10: 7A | M10: 7B | N10: 7H | P10: 9A
E11: Republican | G11: Bright Ideas | H11: Lucky | J11: Republican | L11: Democratic | M11: REPUBLICAN | N11: Green | P11: Democratic
A13: DISTRICT 1 | C13: 683 | D13: 189 | E13: 179 | G13: 60 | H13: 100 | J13: 138 | L13: 99 | M13: 104 | N13: 101 | P13: 129
A14: DISTRICT 2 | C14: 896 | D14: 245 | E14: 190 | G14: 95 | H14: 122 | J14: 188 | L14: 116 | M14: 138 | N14: 128 | P14: 184
A16: TOTAL | C16: =SUM(C13:C14) -> 1579 | D16: =SUM(D13:D14) -> 434 | E16: =SUM(E13:E14) -> 369 | G16: =SUM(G13:G14) -> 155 | H16: =SUM(H13:H14) -> 222 | J16: =SUM(J13:J14) -> 326 | L16: =SUM(L13:L14) -> 215 | M16: =SUM(M13:M14) -> 242 | N16: =SUM(N13:N14) -> 229 | P16: =SUM(P13:P14) -> 313
A20: BAINBRIDGE | C20: REG. | D20: TOTAL | E20: SUPERVISOR | G20: TOWN | J20: TOWN | L20: COUNCILMAN | P20: SUPERINTENDENT
C21: VOTERS | D21: VOTED | G21: CLERK | J21: JUSTICE | P21: OF HIGHWAYS
E23: Dolores | G23: Deborah K. | J23: Gary F. | L23: Robert G. | M23: Kenneth W. | P23: Gary R.
E24: NABINGER | G24: HROMADA | J24: ANDERSON | L24: EVANS | M24: BARTON | P24: RICHMAN
E25: 4A | G25: 5A | J25: 6B | L25: 7A | M25: 8A | P25: 9A
E26: Democratic | G26: Democratic | J26: Republican | L26: Democratic | M26: Democratic | P26: Democratic
A28: DISTRICT 1 | C28: 914 | D28: 190 | E28: 144 | G28: 170 | J28: 144 | L28: 148 | M28: 134 | P28: 157
A29: DISTRICT 2 | C29: 1006 | D29: 180 | E29: 147 | G29: 161 | J29: 147 | L29: 145 | M29: 135 | P29: 161
A31: TOTAL | C31: =SUM(C28:C29) -> 1920 | D31: =SUM(D28:D29) -> 370 | E31: =SUM(E28:E29) -> 291 | G31: =SUM(G28:G29) -> 331 | J31: =SUM(J28:J29) -> 291 | L31: =SUM(L28:L29) -> 293 | M31: =SUM(M28:M29) -> 269 | P31: =SUM(P28:P29) -> 318
A35: COLUMBUS | C35: REG. | D35: TOTAL | E35: SUPERVISOR | G35: TOWN | L35: COUNCILMAN | P35: SUPERINTENDENT
C36: VOTERS | D36: VOTED | G36: CLERK | P36: OF HIGHWAYS
E38: George C. | G38: Brenda L. | L38: Kavin E. | M38: Bruce E. | P38: Kevin D.
E39: COATES | G39: WEIDMAN | L39: WINTON | M39: VERMEULEN | P39: CROSS
E40: 4C | G40: 5A | L40: 6B | M40: 7B | P40: 8B
E41: Independence | G41: Democratic | L41: Republican | M41: Republican | P41: Republican
A43: TOTAL | C43: 528 | D43: 97 | E43: 78 | G43: 82 | L43: 84 | M43: 84 | P43: 88