A1: OFFICIAL RESULTS | F1: CHENANGO COUNTY
F2: OFFICIAL RESULTS
F3: November 8, 2011 General Election
Q5: SUPERINTENDENT
E6: SUPERVISOR | G6: TOWN CLERK | H6: TOWN CLERK | J6: JUSTICE | O6: COUNCILMAN | Q6: OF HIGHWAYS
D7: David J. | E7: Evan T. | F7: David J. | G7: Nika M. | H7: Nika M. | I7: Kelly | J7: Charles E. | K7: Kelly | L7: Charles E. | M7: Jay C. | N7: Louise F. | O7: William F. | P7: Hugh H. | Q7: Steven W. | R7: Steven W.
A8: TOWN | B8: REG. | C8: TOTAL | D8: MESSINEO | E8: WILLIAMS | F8: MESSINEO | G8: COLE | H8: COLE | I8: MOYER | J8: SEWARD | K8: MOYER | L8: SEWARD | M8: GRAHAM | N8: PERRY | O8: WALTZ | P8: COMFORT | Q8: FORREST | R8: FORREST
A9: OTSELIC | B9: VOTERS | C9: VOTED | D9: 2A | E9: 2B | F9: 2I | G9: 3A | H9: 3B | I9: 4A | J9: 4B | K9: 4G | L9: 4H | M9: 5A | N9: 5B | O9: 5A | P9: 5B | Q9: 7A | R9: 7B
D10: Democratic | E10: Republcian | F10: Common Sense | G10: Democratic | H10: Republican | I10: Democratic | J10: Republcian | K10: Justice | L10: Otselic Voters | M10: Democratic | N10: Republican | O10: Democratic | P10: Republican | Q10: Democratic | R10: Republican
A12: TOTAL | B12: 589 | C12: 310 | D12: 131 | E12: 168 | F12: 10 | G12: 116 | H12: 152 | I12: 168 | J12: 125 | K12: 1 | L12: 4 | M12: 142 | N12: 183 | O12: 86 | P12: 191 | Q12: 136 | R12: 157
D14: SUPERVISOR | E14: TOWN CLERK | F14: JUSTICE | G14: COUNCILMAN
D15: Lawrence N. | E15: James W. | F15: John V. | G15: Jerry A. | H15: Alan D.
A16: TOWN | B16: REG. | C16: TOTAL | D16: WILCOX | E16: HEMSTROUGHT,JR. | F16: WEIDMAN | G16: LOCKE | H16: DAVIS
A17: OXFORD | B17: VOTERS | C17: VOTED | D17: 2B | E17: 3A | F17: 4A | G17: 5A | H17: 5B
D18: Republican | E18: Democratic | F18: Democratic | G18: Democratic | H18: Republican
A19: DISTRICT 1 | B19: 969 | C19: 95 | D19: 86 | E19: 78 | F19: 80 | G19: 54 | H19: 72
A20: DISTRICT 2 | B20: 575 | C20: 51 | D20: 42 | E20: 42 | F20: 45 | G20: 38 | H20: 35
A21: DISTRICT 3 | B21: 684 | C21: 63 | D21: 55 | E21: 56 | F21: 58 | G21: 46 | H21: 42
A22: TOTAL | B22: =SUM(B19:B21) -> 2228 | C22: =SUM(C19:C21) -> 209 | D22: =SUM(D19:D21) -> 183 | E22: =SUM(E19:E21) -> 176 | F22: =SUM(F19:F21) -> 183 | G22: =SUM(G19:G21) -> 138 | H22: =SUM(H19:H21) -> 149
L24: COUNCILMAN | N24: SUPERINTENDENT
D25: SUPERVISOR | E25: TOWN CLERK | G25: JUSTICE | I25: COUNCILMAN | L25: TO FILL VACANCY | N25: OF HIGHWAYS
D26: Dennis O. | E26: Susie P. | F26: Susie P. | G26: Lynn A. | H26: Darrell J. | I26: Kenneth L. | J26: Darin J. | K26: Shannon D. | L26: Diane M. | M26: Loris E. | N26: Thomas M.
A27: TOWN | B27: REG. | C27: TOTAL | D27: BROWN | E27: GRANGER | F27: GRANGER | G27: MURRAY | H27: WOOD | I27: GRANGER | J27: SMITH | K27: SMITH | L27: FANELLI | M27: COLLIER | N27: SLATE
A28: PHARSALIA | B28: VOTERS | C28: VOTED | D28: 2A | E28: 3A | F28: 3B | G28: 4B | H28: 5A | I28: 5B | J28: 6A | K28: 6B | L28: 7A | M28: 7B | N28: 8A
D29: Democratic | E29: Democratic | F29: Republcian | G29: Republcian | H29: Democratic | I29: Republican | J29: Democratic | K29: Republican | L29: Democratic | M29: Republican | N29: Democratic
A31: TOTAL | B31: 329 | C31: 93 | D31: 74 | E31: 33 | F31: 44 | G31: 64 | H31: 40 | I31: 41 | J31: 51 | K31: 40 | L31: 46 | M31: 36 | N31: 76
D34: SUPERVISOR | F34: JUSTICE | G34: JUSTICE | I34: COUNCILMAN
D35: Jeffrey B. | E35: Jeffrey B. | F35: Robert A. | G35: Robert A. | H35: Alan R. | I35: Alan R. | J35: Bruce W. | K35: Bruce W.
A36: TOWN | B36: REG. | C36: TOTAL | D36: BLANCHARD | E36: BLANCHARD | F36: BRENZEL | G36: BRENZEL | H36: STITH | I36: STITH | J36: HAKES | K36: HAKES
A37: PITCHER | B37: VOTERS | C37: VOTED | D37: 2A | E37: 2B | F37: 3A | G37: 3B | H37: 4A | I37: 4B | J37: 5A | K37: 5B
D38: Democratic | E38: Republican | F38: Democratic | G38: Republican | H38: Democratic | I38: Republican | J38: Democratic | K38: Republican
A40: TOTAL | B40: 423 | C40: 69 | D40: 22 | E40: 44 | F40: 22 | G40: 46 | H40: 23 | I40: 45 | J40: 21 | K40: 46
L42: SUPERINTENDENT
D43: SUPERVISOR | E43: TOWN CLERK | F43: JUSTICE | H43: COUNCILMAN | L43: OF HIGHWAYS
D44: Jerry L. | E44: Marie N. | F44: Paul M. | G44: Diane J. | H44: Gary B. | I44: Kelly K. | J44: Lewis W. | K44: Peter A. | L44: Peter D.
A45: TOWN | B45: REG. | C45: TOTAL | D45: KREINER | E45: WHALEY | F45: O'CONNOR | G45: BUCINO | H45: SIMPSON | I45: CUSHMAN | J45: SOMERS | K45: HUDIBURG | L45: MARSHALL
A46: PLYMOUTH | B46: VOTERS | C46: VOTED | D46: 2B | E46: 3B | F46: 4B | G46: 5A | H46: 5B | I46: 6A | J46: 6B | K46: 5G | L46: 7B
D47: Republican | E47: Republican | F47: Republican | G47: Democratic | H47: Republican | I47: Democratic | J47: Republican | K47: Clean Water | L47: Republican
A49: TOTAL | B49: 1019 | C49: 311 | D49: 223 | E49: 250 | F49: 219 | G49: 58 | H49: 167 | I49: 66 | J49: 155 | K49: 90 | L49: 239