A12: OFFICIAL RESULTS | I12: CHENANGO COUNTY
I13: OFFICIAL RESULTS
A14: November 6, 2007 General Election
A16: TOWNS
F17: SUPERVISOR | G17: COUNCIL | H17: COUNCIL
C18: REG. | D18: NUMBER | F18: Robert D. | G18: Jamie L. | H18: Calvin
C19: VOTERS | D19: VOTED | F19: BRIGGS | G19: BACIUSKA | H19: TALLMADGE
F20: Republican 6B | G20: Republican 7B | H20: Republican 8B
A21: AFTON 1 | C21: 666 | D21: 72 | F21: 55 | G21: 52 | H21: 50
A22: AFTON 2 | C22: 876 | D22: 136 | F22: 107 | G22: 94 | H22: 94
A24: TOTAL | C24: =SUM(C10:C11) -> 1542 | D24: =SUM(D10:D11) -> 208 | F24: =SUM(F10:F11) -> 162 | G24: =SUM(G10:G11) -> 146 | H24: =SUM(H10:H11) -> 144
F27: SUPERVISOR | G27: JUSTICE | H27: JUSTICE | I27: COUNCIL | J27: COUNCIL
C28: REG. | D28: NUMBER | F28: Rick E. | G28: Steven W. | H28: John L. | I28: Delores | J28: Rexford Z.
C29: VOTERS | D29: VOTED | F29: CHASE | G29: KLUGH | H29: HYZER | I29: NABINGER | J29: THORNTON
F30: Democratic 6A | G30: Democratic 7A | H30: Republican 7B | I30: Democratic 8A | J30: Republican 8B
A31: BAINBRIDGE 1 | C31: 882 | D31: 223 | F31: 144 | G31: 140 | H31: 58 | I31: 104 | J31: 118
A32: BAINBRIDGE 2 | C32: 1009 | D32: 274 | F32: 183 | G32: 178 | H32: 73 | I32: 133 | J32: 155
A34: TOTAL | C34: =SUM(C20:C21) -> 1891 | D34: =SUM(D20:D21) -> 497 | F34: =SUM(F20:F21) -> 327 | G34: =SUM(G20:G21) -> 318 | H34: =SUM(H20:H21) -> 131 | I34: =SUM(I20:I21) -> 237 | J34: =SUM(J20:J21) -> 273
P36: SUPERINTENDENT | Q36: SUPERINTENDENT | R36: SUPERINTENDENT | S36: SUPERINTENDENT | T36: SUPERINTENDENT
F37: SUPERVISOR | G37: CLERK | H37: JUSTICE | I37: JUSTICE | J37: JUSTICE | K37: COUNCIL | L37: COUNCIL | M37: COUNCIL | N37: COUNCIL | O37: COUNCIL | P37: OF HIGHWAYS | Q37: OF HIGHWAYS | R37: OF HIGHWAYS | S37: OF HIGHWAYS | T37: OF HIGHWAYS
F38: George G. | G38: Brenda L. | H38: Anthony P. | I38: Richard M. | J38: Richard M. | K38: William D. | L38: Anna H. | M38: Michael S. | N38: Duglas M. | O38: Alan D. | P38: Bruce F. | Q38: Kevin D. | R38: Bruce F. | S38: Kevin D. | T38: Ricky E.
C39: REG. | D39: NUMBER | F39: COATES | G39: WEIDMAN | H39: BELLEFONTAINE | I39: FORNITO, SR. | J39: FORNITO, SR. | K39: ENDRESS, SR. | L39: SENN | M39: THOMSEN | N39: CLARK | O39: SMITH | P39: SIMMONS | Q39: CROSS | R39: SIMMONS | S39: CROSS | T39: DAVIS
C40: VOTERS | D40: VOTED | F40: Independence 6C | G40: Democratic 7A | H40: Democratic 8A | I40: Republican 8B | J40: Equal Justice 8H | K40: Democratic 9A | L40: Republican 9B | M40: Community Vision 9I | N40: Republican 10B | O40: Open Door 10I | P40: Democratic 11A | Q40: Republican 11B | R40: Peoples Choice 11F | S40: Better Roads 11G | T40: Improved Highways 11H
A41: COLUMBUS 1 | C41: 516 | D41: 272 | F41: 139 | G41: 191 | H41: 74 | I41: 141 | J41: 16 | K41: 119 | L41: 77 | M41: 77 | N41: 55 | O41: 112 | P41: 47 | Q41: 125 | R41: 6 | S41: 27 | T41: 61
A43: TOTAL | C43: 516 | D43: 272 | F43: 139 | G43: 191 | H43: 74 | I43: 141 | J43: 16 | K43: 119 | L43: 77 | M43: 77 | N43: 55 | O43: 112 | P43: 47 | Q43: 125 | R43: 6 | S43: 27 | T43: 61
J45: SUPERINTENDENT | K45: SUPERINTENDENT | L45: SUPERINTENDENT
F46: SUPERVISOR | G46: CLERK | H46: COUNCIL | I46: COUNCIL | J46: OF HIGHWAYS | K46: OF HIGHWAYS | L46: OF HIGHWAYS
F47: Janice A. | G47: Theresa A. | H47: Harvey E. | I47: Marion L. | J47: Keith E. | K47: Keith E. | L47: Larry A.
C48: REG. | D48: NUMBER | F48: O'SHEA | G48: SCHULTHEIS | H48: FLETCHER | I48: IRELAND | J48: IVES, SR | K48: IVES, SR | L48: HATTON
C49: VOTERS | D49: VOTED | F49: Republican 6B | G49: Republican 7B | H49: Republican 8B | I49: Republican 9B | J49: Republican10 B | K49: Common Sense 10F | L49: New Roads 10G
A50: COVENTRY 1 | C50: 890 | D50: 359 | F50: 231 | G50: 244 | H50: 242 | I50: 204 | J50: 155 | K50: 34 | L50: 161
A52: TOTAL | C52: 890 | D52: 359 | F52: 231 | G52: 244 | H52: 242 | I52: 204 | J52: 155 | K52: 34 | L52: 161
R54: SUPERINTENDENT | S54: SUPERINTENDENT
F55: SUPERVISOR | G55: SUPERVISOR | H55: CLERK | I55: CLERK | J55: COUNCIL | K55: COUNCIL | L55: COUNCIL | M55: COUNCIL | N55: ASSESSOR | O55: ASSESSOR | P55: ASSESSOR | Q55: ASSESSOR | R55: OF HIGHWAYS | S55: OF HIGHWAYS
F56: Richard C. | G56: Richard C. | H56: Ellen T. | I56: Ellen T. | J56: Steven F. | K56: Steven F. | L56: Elaine A. | M56: Elaine A. | N56: Stephen J. | O56: Stephen J. | P56: Lisa A. | Q56: Lisa A. | R56: Gerald R. | S56: Gerald R.
C57: REG. | D57: NUMBER | F57: SCHLAG | G57: SCHLAG | H57: MARONEY | I57: MARONEY | J57: MARONEY | K57: MARONEY | L57: WARREN | M57: WARREN | N57: COLLINS | O57: COLLINS | P57: TEICHERT | Q57: TEICHERT | R57: TEMPLE | S57: TEMPLE
C58: VOTERS | D58: VOTED | F58: Democratic 6A | G58: Republican 6B | H58: Democratic 7A | I58: Republican 7B | J58: Democratic 8A | K58: Republican 8B | L58: Democratic 9A | M58: Republican 9B | N58: Democratic 10A | O58: Republican 10B | P58: Democratic 11A | Q58: Republican 11B | R58: Democratic 12A | S58: Republican 12B
A59: GERMAN | C59: 215 | D59: 67 | F59: 32 | G59: 29 | H59: 34 | I59: 28 | J59: 31 | K59: 25 | L59: 33 | M59: 27 | N59: 33 | O59: 30 | P59: 30 | Q59: 28 | R59: 33 | S59: 27
A61: TOTAL | C61: 215 | D61: 67 | F61: 32 | G61: 29 | H61: 34 | I61: 28 | J61: 31 | K61: 25 | L61: 33 | M61: 27 | N61: 33 | O61: 30 | P61: 30 | Q61: 28 | R61: 33 | S61: 27
O63: COUNCIL | P63: COUNCIL | Q63: COUNCIL
F64: SUPERVISOR | G64: CLERK | H64: CLERK | I64: CLERK | J64: JUSTICE | K64: COUNCIL | L64: COUNCIL | M64: COUNCIL | N64: COUNCIL | O64: TO FILL VACANCY | P64: TO FILL VACANCY | Q64: TO FILL VACANCY
C65: REG. | D65: NUMBER | F65: Jack T. | G65: Deborah L. | H65: Carla D. | I65: Deborah L. | J65: Dante P. | K65: Stephen L. | L65: Diane M. | M65: Gordon L. | N65: David C. | O65: Robert W. | P65: Joshua P. | Q65: Joshua P.
C66: VOTERS | D66: VOTED | F66: COOK | G66: THOMAS | H66: BROWN | I66: THOMAS | J66: ACUNTO | K66: PAGE | L66: FLANAGAN | M66: WESTCOTT, JR. | N66: YOUNG | O66: RAIMO | P66: BROWNING | Q66: BROWNING
F67: Republican 6B | G67: Republican 7B | H67: Square Deal 7F | I67: Open Door 7G | J67: Republican 8B | K67: Democratic 9A | L67: Republican 9B | M67: Democratic 10A | N67: Republican 10B | O67: Democratic 11A | P67: Republican 11B | Q67: Square Deal 11F
A68: GREENE 1 | C68: 667 | D68: 284 | F68: 223 | G68: 186 | H68: 73 | I68: 14 | J68: 188 | K68: 96 | L68: 176 | M68: 73 | N68: 144 | O68: 86 | P68: 148 | Q68: 10
A69: GREENE 2 | C69: 840 | D69: 321 | F69: 225 | G69: 184 | H69: 98 | I69: 17 | J69: 171 | K69: 143 | L69: 193 | M69: 86 | N69: 126 | O69: 87 | P69: 169 | Q69: 16
A70: GREENE 3 | C70: 949 | D70: 324 | F70: 226 | G70: 192 | H70: 87 | I70: 28 | J70: 197 | K70: 124 | L70: 175 | M70: 101 | N70: 161 | O70: 91 | P70: 170 | Q70: 12
A71: GREENE 4 | C71: 797 | D71: 352 | F71: 237 | G71: 188 | H71: 106 | I71: 27 | J71: 189 | K71: 132 | L71: 213 | M71: 90 | N71: 171 | O71: 101 | P71: 179 | Q71: 14
A73: TOTAL | C73: =SUM(C59:C62) -> 3253 | D73: =SUM(D59:D62) -> 1281 | F73: =SUM(F59:F62) -> 911 | G73: =SUM(G59:G62) -> 750 | H73: =SUM(H59:H62) -> 364 | I73: =SUM(I59:I62) -> 86 | J73: =SUM(J59:J62) -> 745 | K73: =SUM(K59:K62) -> 495 | L73: =SUM(L59:L62) -> 757 | M73: =SUM(M59:M62) -> 350 | N73: =SUM(N59:N62) -> 602 | O73: =SUM(O59:O62) -> 365 | P73: =SUM(P59:P62) -> 666 | Q73: =SUM(Q59:Q62) -> 52
F75: PROPOSITON | G75: PROPOSITON | H75: SUPERVISOR | I75: CLERK | J75: COUNCIL | K75: COUNCIL | L75: COUNCIL | M75: COUNCIL | N75: ASSESSOR | O75: ASSESSOR
C76: REG. | D76: NUMBER | F76: NUMBER ONE | G76: NUMBER ONE | H76: Alton B. | I76: Barbara R. | J76: Joseph E. | K76: Rodney G. | L76: Gary M. | M76: George J. | N76: Susan E. | O76: Kathleen M.
C77: VOTERS | D77: VOTED | F77: YES | G77: NO | H77: DOYLE | I77: STRIER | J77: ZACZEK | K77: SCHULTES | L77: MORGAN | M77: SENECK | N77: MCINTYRE | O77: TIFFANY
H78: Republican 6B | I78: Republican 7B | J78: Democratic 8A | K78: Republican 8B | L78: Democratic 9A | M78: Republican 9B | N78: Democratic 10A | O78: Open Door 10F
A79: GUILFORD 1 | C79: 673 | D79: 245 | F79: 128 | G79: 76 | H79: 137 | I79: 139 | J79: 145 | K79: 93 | L79: 59 | M79: 133 | N79: 107 | O79: 57
A80: GUILFORD 2 | C80: 866 | D80: 368 | F80: 183 | G80: 130 | H80: 227 | I80: 256 | J80: 136 | K80: 180 | L80: 98 | M80: 187 | N80: 172 | O80: 78
A82: TOTAL | C82: =SUM(C71:C72) -> 1539 | D82: =SUM(D71:D72) -> 613 | F82: =SUM(F71:F72) -> 311 | G82: =SUM(G71:G72) -> 206 | H82: =SUM(H71:H72) -> 364 | I82: =SUM(I71:I72) -> 395 | J82: =SUM(J71:J72) -> 281 | K82: =SUM(K71:K72) -> 273 | L82: =SUM(L71:L72) -> 157 | M82: =SUM(M71:M72) -> 320 | N82: =SUM(N71:N72) -> 279 | O82: =SUM(O71:O72) -> 135
I84: SUPERINTENDENT
F85: SUPERVISOR | G85: COUNCIL | H85: COUNCIL | I85: OF HIGHWAYS
C86: REG. | D86: NUMBER | F86: Wayne C. | G86: Steven A. | H86: Patrick H. | I86: Rodney
C87: VOTERS | D87: VOTED | F87: OUTWATER | G87: WARNER | H87: HOLL | I87: LOSAW
F88: Republican 6B | G88: Republcian 7B | H88: Republican 8B | I88: Republican 9B
A89: LINCKLEAN 1 | C89: 256 | D89: 76 | F89: 65 | G89: 63 | H89: 66 | I89: 66
A91: TOTAL | C91: 256 | D91: 76 | F91: 65 | G91: 63 | H91: 66 | I91: 66
N93: SUPERINTENDENT | O93: SUPERINTENDENT
F94: SUPERVISOR | G94: SUPERVISOR | H94: CLERK | I94: CLERK | J94: COUNCIL | K94: COUNCIL | L94: COUNCIL | M94: COUNCIL | N94: OF HIGHWAYS | O94: OF HIGHWAYS
C95: REG. | D95: NUMBER | F95: Homer D. | G95: Arrinton J. | H95: Donna M. | I95: Donna M. | J95: Karol L. | K95: Leon K. | L95: Patricia | M95: Penny L. | N95: Lawrence H. | O95: Ralph H.
C96: VOTERS | D96: VOTED | F96: SMITH | G96: CONNOR | H96: PRESTON | I96: PRESTON | J96: PROPPE | K96: BARROWS | L96: CLENDENING | M96: BECKWITH | N96: BECKWITH | O96: SICKLER
F97: Democratic 6A | G97: Republican 6B | H97: Democratic 7A | I97: Republican 7B | J97: Democratic 8A | K97: Republican 8B | L97: Democratic 9A | M97: Republican 9B | N97: Democratic 10A | O97: Republican 10B
A98: MCDONOUGH 1 | C98: 584 | D98: 307 | F98: 130 | G98: 162 | H98: 118 | I98: 129 | J98: 83 | K98: 199 | L98: 82 | M98: 165 | N98: 189 | O98: 91
A100: TOTAL | C100: 584 | D100: 307 | F100: 130 | G100: 162 | H100: 118 | I100: 129 | J100: 83 | K100: 199 | L100: 82 | M100: 165 | N100: 189 | O100: 91
F102: SUPERVISOR | G102: CLERK | H102: JUSTICE | I102: COUNCIL | J102: COUNCIL
C103: REG. | D103: NUMBER | F103: Ross | G103: Mary B. | H103: Joseph G. | I103: Roger P. | J103: Roy R.
C104: VOTERS | D104: VOTED | F104: IANNELLO | G104: BROWN | H104: BRILLINGER, JR. | I104: FOOTE | J104: STOCKWELL
F105: Open Door 6F | G105: Republican 7B | H105: Republican 8B | I105: Republican 8B | J105: Republican 10B
A106: NEW BERLIN 1 | C106: 707 | D106: 118 | F106: 78 | G106: 87 | H106: 80 | I106: 91 | J106: 77
A107: NEW BERLIN 2 | C107: 690 | D107: 141 | F107: 77 | G107: 111 | H107: 114 | I107: 111 | J107: 112
A109: TOTAL | C109: =SUM(C101:C102) -> 1397 | D109: =SUM(D101:D102) -> 259 | F109: =SUM(F101:F102) -> 155 | G109: =SUM(G101:G102) -> 198 | H109: =SUM(H101:H102) -> 194 | I109: =SUM(I101:I102) -> 202 | J109: =SUM(J101:J102) -> 189
J111: SUPERINTENDENT
F112: SUPERVISOR | G112: CLERK | H112: COUNCIL | I112: COUNCIL | J112: OF HIGHWAYS
C113: REG. | D113: NUMBER | F113: Richard B. | G113: Loretta L. | H113: Linda K. | I113: Penny M. | J113: Albert B.
C114: VOTERS | D114: VOTED | F114: DECKER | G114: SMITH | H114: SEYMOUR | I114: FITZPATRICK | J114: ROUNDS
F115: Republican 6B | G115: Republian 7B | H115: Republian 8B | I115: Republian 9B | J115: Republian 10B
A116: NORTH NORWICH 1 | C116: 769 | D116: 160 | F116: 121 | G116: 137 | H116: 125 | I116: 120 | J116: 118
A117: NORTH NORWICH 2 | C117: 210 | D117: 22 | F117: 15 | G117: 17 | H117: 14 | I117: 13 | J117: 19
A119: TOTAL | C119: =SUM(C113:C114) -> 979 | D119: =SUM(D113:D114) -> 182 | F119: =SUM(F113:F114) -> 136 | G119: =SUM(G113:G114) -> 154 | H119: =SUM(H113:H114) -> 139 | I119: =SUM(I113:I114) -> 133 | J119: =SUM(J113:J114) -> 137
M122: ASSESSOR | N122: SUPERINTENDENT
F123: SUPERVISOR | G123: CLERK | H123: JUSTICE | I123: COUNCIL | J123: COUNCIL | K123: ASSESSOR | L123: ASSESSOR | M123: TO FILL VACANCY | N123: OF HIGHWAYS | O123: TAX COLLECTOR
C124: REG. | D124: NUMBER | F124: David C. | G124: Sharon A. | H124: David J. | I124: Charles W. | J124: Milton H. | K124: David R. | L124: Michael A. | M124: Mary C.E. | N124: Stanley D. | O124: Barbara E.
C125: VOTERS | D125: VOTED | F125: LAW | G125: GOHL-MUSERALLO | H125: EVANS | I125: BROOKS | J125: SHEPLER | K125: ADAMS | L125: GIBBON | M125: MANLEY | N125: FOULDS | O125: ANNESI
F126: Republican 6B | G126: Republian 7B | H126: Republican 8B | I126: Republican 9B | J126: Republican 10B | K126: Republican 11B | L126: Republican 12B | M126: Republican 13B | N126: Republican 14B | O126: Republican 15B
A127: NORWICH 1 | C127: 777 | D127: 153 | F127: 119 | G127: 112 | H127: 128 | I127: 120 | J127: 112 | K127: 108 | L127: 118 | M127: 108 | N127: 103 | O127: 126
A128: NORWICH 2 | C128: 620 | D128: 144 | F128: 110 | G128: 99 | H128: 100 | I128: 96 | J128: 75 | K128: 88 | L128: 99 | M128: 98 | N128: 91 | O128: 105
A129: NORWICH 3 | C129: 871 | D129: 165 | F129: 121 | G129: 118 | H129: 119 | I129: 120 | J129: 115 | K129: 99 | L129: 116 | M129: 104 | N129: 96 | O129: 128
A131: TOTAL | C131: =SUM(C124:C126) -> 2268 | D131: =SUM(D124:D126) -> 462 | F131: =SUM(F124:F126) -> 350 | G131: =SUM(G124:G126) -> 329 | H131: =SUM(H124:H126) -> 347 | I131: =SUM(I124:I126) -> 336 | J131: =SUM(J124:J126) -> 302 | K131: =SUM(K124:K126) -> 295 | L131: =SUM(L124:L126) -> 333 | M131: =SUM(M124:M126) -> 310 | N131: =SUM(N124:N126) -> 290 | O131: =SUM(O124:O126) -> 359
H133: SUPERVISOR | I133: SUPERVISOR | J133: SUPERVISOR | K133: SUPERVISOR | L133: ALDERMAN | M133: ALDERMAN | N133: ALDERMAN
F134: MAYOR | G134: MAYOR | H134: WARD 1,2,3 | I134: WARD 1,2,3 | J134: WARD 1,2,3 | K134: WARD 4,5,6 | L134: WARD 1 | M134: WARD 3 | N134: WARD 5
F135: Michael T. | G135: Joseph P. | H135: James J. | I135: Scott M. | J135: James J. | K135: Linda E. | L135: Robert M. | M135: John F. | N135: Paul J.
A136: NORWICH CITY | C136: REG. | D136: NUMBER | F136: CARNRIKE | G136: MAIURANO | H136: MCNEIL | I136: SUTTON | J136: MCNEIL | K136: NATOLI | L136: CAREY | M136: DEIERLEIN | N136: LAUGHLIN
C137: VOTERS | D137: VOTED | F137: Democratic 6A | G137: REPUBLICAN 6B | H137: Democratic 7A | I137: Square Deal 7F | J137: Quality of Life 7G | K137: Republican 7B | L137: Republican 8B | M137: Republican 8B | N137: Republican 8B
A138: WARD 1 | C138: 689 | D138: 316 | F138: 156 | G138: 144 | H138: 151 | I138: 124 | J138: 10 | L138: 137
A139: WARD 2 | C139: 588 | D139: 265 | F139: 117 | G139: 130 | H139: 123 | I139: 103 | J139: 10
A140: WARD 3 | C140: 784 | D140: 426 | F140: 146 | G140: 256 | H140: 187 | I140: 184 | J140: 14 | M140: 202
A141: WARD 4 | C141: 471 | D141: 192 | F141: 71 | G141: 113 | K141: 116
A142: WARD 5 | C142: 561 | D142: 246 | F142: 72 | G142: 169 | K142: 165 | N142: 161
A143: WARD 6 | C143: 603 | D143: 240 | F143: 105 | G143: 130 | K143: 152
A145: TOTAL | C145: =SUM(C136:C141) -> 3696 | D145: =SUM(D136:D141) -> 1685 | F145: =SUM(F136:F141) -> 667 | G145: =SUM(G136:G141) -> 942 | H145: =SUM(H136:H138) -> 461 | I145: =SUM(I136:I138) -> 411 | J145: =SUM(J136:J138) -> 34 | K145: =SUM(K139:K141) -> 433 | L145: =SUM(L136:L141) -> 137 | M145: =SUM(M136:M141) -> 202 | N145: =SUM(N136:N141) -> 161
Q147: SUPERINTENDENT
H148: WRITE-IN | J148: WIRTE-IN | K148: WIRTE-IN | M148: COUNCIL | N148: COUNCIL | O148: COUNCIL | P148: COUNCIL | Q148: OF HIGHWAYS
F149: SUPERVISOR | G149: SUPERVISOR | H149: SUPERVISOR | I149: CLERK | J149: CLERK | K149: CLERK | L149: JUSTICE | M149: Jay C. | N149: Jay C. | O149: Louise F. | P149: Daryel M. | Q149: Steven W.
C150: REG. | D150: NUMBER | F150: David J. | G150: David J. | H150: David | I150: Joan H. | J150: Tonia | K150: Collette | L150: Hugh H. | M150: GRAHAM | N150: GRAHAM | O150: PERRY | P150: JENSEN | Q150: FORREST
C151: VOTERS | D151: VOTED | F151: MESSINEO | G151: MESSINEO | H151: MARTIN | I151: GEIGER | J151: THEIL | K151: MCMURRAY | L151: COMFORT | M151: Democriatic 9A | N151: Republican 9B | O151: Democratic 10A | P151: Republican 10B | Q151: Republican 11B
F152: Democratic 6A | G152: Common Sense 6F | I152: Democtrtic 7A | L152: Republican 8B | M152: 90 | N152: 102 | O152: 167 | P152: 66 | Q152: 182
A153: OTSELIC 1 | C153: 556 | D153: 244 | F153: 105 | G153: 12 | H153: 69 | I153: 59 | J153: 62 | K153: 44 | L153: 166
A155: TOTAL | C155: 556 | D155: 244 | F155: 105 | G155: 12 | H155: 69 | I155: 59 | J155: 62 | K155: 44 | L155: 166 | M155: 90 | N155: 102 | O155: 167 | P155: 66 | Q155: 182
F157: SUPERVISOR | G157: CLERK | H157: JUSTICE | I157: JUSTICE | J157: JUSTICE | K157: COUNCIL | L157: COUNCIL
C158: REG. | D158: NUMBER | F158: Lawrence N. | G158: James W. | H158: John V. | I158: Robert Paul | J158: Kathleen M. | K158: Dennis E. | L158: Jerry A.
C159: VOTERS | D159: VOTED | F159: WILCOX | G159: HEMSTROUGHT, JR | H159: WEIDMAN | I159: THOMPSON | J159: MOSER | K159: RYAN | L159: LOCKE
F160: Republican 6B | G160: Democratic 7A | H160: Democratic 8A | I160: Republican 8B | J160: Scales of Justice | K160: Democratic 9A | L160: Democratic 10A
A161: OXFORD 1 | C161: 928 | D161: 262 | F161: 166 | G161: 167 | H161: 159 | I161: 56 | J161: 40 | K161: 158 | L161: 152
A162: OXFORD 2 | C162: 569 | D162: 170 | F162: 111 | G162: 118 | H162: 113 | I162: 21 | J162: 29 | K162: 114 | L162: 104
A163: OXFORD 3 | C163: 681 | D163: 176 | F163: 112 | G163: 127 | H163: 91 | I163: 43 | J163: 30 | K163: 101 | L163: 106
A165: TOTAL | C165: =SUM(C160:C162) -> 2178 | D165: =SUM(D160:D162) -> 608 | F165: =SUM(F160:F162) -> 389 | G165: =SUM(G160:G162) -> 412 | H165: =SUM(H160:H162) -> 363 | I165: =SUM(I160:I162) -> 120 | J165: =SUM(J160:J162) -> 99 | K165: =SUM(K160:K162) -> 373 | L165: =SUM(L160:L162) -> 362
O167: SUPERINTENDENT | P167: SUPERINTENDENT
F168: SUPERVISOR | G168: SUPERVISOR | H168: CLERK | I168: CLERK | J168: JUSTICE | K168: JUSTICE | L168: COUNCIL | M168: COUNCIL | N168: COUNCIL | O168: OF HIGHWAYS | P168: OF HIGHWAYS
C169: REG. | D169: NUMBER | F169: Dennis O. | G169: Dennis O. | H169: Susie P. | I169: Susie P. | J169: Lynn A. | K169: Lynn A. | L169: Diane M. | M169: Brenda L. | N169: Kenneth L. | O169: Clayton M. | P169: Matthew Duke
C170: VOTERS | D170: VOTED | F170: BROWN | G170: BROWN | H170: GRANGER | I170: GRANGER | J170: MURRAY | K170: MURRAY | L170: FANELLI | M170: SMITH | N170: GRANGER | O170: ALGER | P170: SMITH
F171: Democratic 6A | G171: Republican 6B | H171: Democratic 6A | I171: Republican 6B | J171: Democratic 6A | K171: Republican 6B | L171: Democratic 9A | M171: Republican 9B | N171: Republican 10B | O171: Democratic 11A | P171: Republican 11B
A172: PHARSALIA 1 | C172: 345 | D172: 138 | F172: 67 | G172: 45 | H172: 64 | I172: 59 | J172: 51 | K172: 44 | L172: 61 | M172: 61 | N172: 69 | O172: 84 | P172: 47
A174: TOTAL | C174: 345 | D174: 138 | F174: 67 | G174: 45 | H174: 64 | I174: 59 | J174: 51 | K174: 44 | L174: 61 | M174: 61 | N174: 69 | O174: 84 | P174: 47
P176: SUPERINTENDENT | Q176: SUPERINTENDENT
F177: SUPERVISOR | G177: SUPERVISOR | H177: CLERK | I177: CLERK | J177: JUSTICE | K177: JUSTICE | L177: COUNCIL | M177: COUNCIL | N177: COUNCIL | O177: COUNCIL | P177: OF HIGHWAYS | Q177: OF HIGHWAYS
C178: REG. | D178: NUMBER | F178: Jeffrey B. | G178: Jeffrey B. | H178: Rita H. | I178: Rita H. | J178: Robert A. | K178: Robert A. | L178: Bruce W. | M178: Bruce W. | N178: Alan R. | O178: Alan R. | P178: Brad A. | Q178: Brad A.
C179: VOTERS | D179: VOTED | F179: BLANCHARD | G179: BLANCHARD | H179: STITH | I179: STITH | J179: BRENZEL | K179: BRENZEL | L179: HAKES | M179: HAKES | N179: STITH | O179: STITH | P179: HOTALING | Q179: HOTALING
F180: Democratic 6A | G180: Republican 6B | H180: Democratic 6A | I180: Republican 6B | J180: Democratic 6A | K180: Republican 6B | L180: Democratic 9A | M180: Republican 9B | N180: Democratic 10A | O180: Republican 10B | P180: Democratic 11A | Q180: Republican 11B
A181: PITCHER 1 | C181: 429 | D181: 95 | F181: 36 | G181: 52 | H181: 36 | I181: 53 | J181: 33 | K181: 49 | L181: 36 | M181: 51 | N181: 33 | O181: 52 | P181: 35 | Q181: 53
A183: TOTAL | C183: 429 | D183: 95 | F183: 36 | G183: 52 | H183: 36 | I183: 53 | J183: 33 | K183: 49 | L183: 36 | M183: 51 | N183: 33 | O183: 52 | P183: 35 | Q183: 53
N185: SUPERINTENDENT
F186: SUPERVISOR | G186: CLERK | H186: JUSTICE | I186: JUSTICE | J186: COUNCIL | K186: COUNCIL | L186: COUNCIL | M186: COUNCIL | N186: OF HIGHWAYS
C187: REG. | D187: NUMBER | F187: Jerry L. | G187: Marie N. | H187: Paul M. | I187: Paul M. | J187: Ricky L. | K187: Gary B. | L187: Gerald E. | M187: Lewis W. | N187: Peter D.
C188: VOTERS | D188: VOTED | F188: KREINER | G188: WHALEY | H188: O'CONNOR | I188: O'CONNOR | J188: ALGER | K188: SIMPSON | L188: CUSHMAN | M188: SOMERS | N188: MARSHALL
F189: Republcian 6B | G189: Republcian 7B | H189: Republcian 8B | I189: Fair Justice 8F | J189: Democratic 9A | K189: Republican 9B | L189: Democratic 10A | M189: Republican 10B | N189: Republican 11B
A190: PLYMOUTH 1 | C190: 984 | D190: 234 | F190: 156 | G190: 171 | H190: 138 | I190: 19 | J190: 71 | K190: 117 | L190: 98 | M190: 110 | N190: 165
A192: TOTAL | C192: 984 | D192: 234 | F192: 156 | G192: 171 | H192: 138 | I192: 19 | J192: 71 | K192: 117 | L192: 98 | M192: 110 | N192: 165
J194: SUPERINTENDENT | K194: SUPERINTENDENT | L194: SUPERINTENDENT
F195: SUPERVISOR | G195: CLERK | H195: COUNCIL | I195: COUNCIL | J195: OF HIGHWAYS | K195: OF HIGHWAYS | L195: OF HIGHWAYS
C196: REG. | D196: NUMBER | F196: Peter C. | G196: Deanna J. | H196: V. Peter V. R. | I196: David L. | J196: Charles K. | K196: Glenn W. | L196: Charles K.
C197: VOTERS | D197: VOTED | F197: FLANAGAN | G197: JOHNSON | H197: MASON | I197: DUNCKEL | J197: STEIN, SR. | K197: DEGEAR | L197: STEIN, SR.
F198: Democratic 6A | G198: Republcian 7B | H198: Democratic 8A | I198: Republican 8B | J198: Republican 10B | K198: Square Deal 10F | L198: Open Door 10G
A199: PRESTON 1 | C199: 668 | D199: 258 | F199: 170 | G199: 199 | H199: 121 | I199: 138 | J199: 132 | K199: 97 | L199: 7
A201: TOTAL | C201: 668 | D201: 258 | F201: 170 | G201: 199 | H201: 121 | I201: 138 | J201: 132 | K201: 97 | L201: 7
I204: TAX COLLECTOR
F205: SUPERVISOR | G205: COUNCIL | H205: COUNCIL | I205: TO FILL VACANCY | J205: LIBRARY TRUSTEE | K205: LIBRARY TRUSTEE
C206: REG. | D206: NUMBER | F206: Harry W. | G206: Glen C. | H206: Stephen J. | I206: Kathy S. | J206: Carolyn L. | K206: Hiram John
C207: VOTERS | D207: VOTED | F207: CONLEY | G207: BAGNALL | H207: PERRIN | I207: MCDANIEL | J207: MERHIB | K207: WARNER
F208: Republican 6B | G208: Republican 7B | H208: Republican 8B | I208: Republican 9B | J208: Democratic 10A | K208: Republican 10B
A209: SHERBURNE 1 | C209: 1028 | D209: 163 | F209: 121 | G209: 125 | H209: 122 | I209: 131 | J209: 97 | K209: 70
A210: SHERBURNE 2 | C210: 393 | D210: 85 | F210: 55 | G210: 56 | H210: 52 | I210: 55 | J210: 38 | K210: 45
A211: SHERBURNE 3 | C211: 717 | D211: 139 | F211: 104 | G211: 108 | H211: 106 | I211: 110 | J211: 84 | K211: 74
A213: TOTAL | C213: =SUM(C212:C214) -> 2138 | D213: =SUM(D212:D214) -> 387 | F213: =SUM(F212:F214) -> 280 | G213: =SUM(G212:G214) -> 289 | H213: =SUM(H212:H214) -> 280 | I213: =SUM(I212:I214) -> 296 | J213: =SUM(J212:J214) -> 219 | K213: =SUM(K212:K214) -> 189
O215: SUPERINTENDENT | P215: SUPERINTENDENT
F216: SUPERVISOR | G216: CLERK | H216: JUSTICE | I216: COUNCIL | J216: COUNCIL | K216: COUNCIL | L216: COUNCIL | M216: COUNCIL | N216: COUNCIL | O216: OF HIGHWAYS | P216: OF HIGHWAYS
C217: REG. | D217: NUMBER | F217: Allan I. | G217: Alison B. | H217: William M. | I217: Elizabeth A. | J217: Vincent J. | K217: Elizabeth A. | L217: Victor H. | M217: Jane M. | N217: Roger J. | O217: Bruce G. | P217: Bruce G.
C218: VOTERS | D218: VOTED | F218: JOHNSON | G218: OWENS | H218: LENGA, JR. | I218: VANDERWEYDE | J218: COLETTA | K218: VANDERWEYDE | L218: HAMMOND | M218: MUSERILLI | N218: CONNELLY | O218: KINNEY | P218: KINNEY
F219: Republcian 6B | G219: Republcian 7B | H219: Republican 8B | I219: Democratic 9A | J219: Republican 9B | K219: Your Choice 9F | L219: Square Deal 9G | M219: Democratic 10A | N219: Republican 10B | O219: Democratic 11A | P219: Square Deal 11G
A220: SMITHVILLE 1 | C220: 317 | D220: 80 | F220: 57 | G220: 63 | H220: 51 | I220: 30 | J220: 39 | K220: 0 | L220: 7 | M220: 19 | N220: 43 | O220: 55 | P220: 4
A221: SMITHVILLE 2 | C221: 475 | D221: 221 | F221: 138 | G221: 151 | H221: 136 | I221: 74 | J221: 93 | K221: 8 | L221: 33 | M221: 53 | N221: 113 | O221: 132 | P221: 25
A223: TOTAL | C223: =SUM(C223:C225) -> 792 | D223: =SUM(D223:D225) -> 301 | F223: =SUM(F223:F225) -> 195 | G223: =SUM(G223:G225) -> 214 | H223: =SUM(H223:H225) -> 187 | I223: =SUM(I223:I225) -> 104 | J223: =SUM(J223:J225) -> 132 | K223: =SUM(K223:K225) -> 8 | L223: =SUM(L223:L225) -> 40 | M223: =SUM(M223:M225) -> 72 | N223: =SUM(N223:N225) -> 156 | O223: =SUM(O223:O225) -> 187 | P223: =SUM(P223:P225) -> 29
N226: SUPERINTENDENT | O226: SUPERINTENDENT
F227: SUPERVISOR | G227: CLERK | H227: JUSTICE | I227: COUNCIL | J227: COUNCIL | K227: COUNCIL | L227: COUNCIL | M227: COUNCIL | N227: OF HIGHWAYS | O227: OF HIGHWAYS
C228: REG. | D228: NUMBER | F228: James B. | G228: Geraldine W. | H228: Gerrard J. | I228: Mark E. | J228: Wayne C. | K228: Debralee L. | L228: Jerry B. | M228: Eric J. | N228: James S. | O228: Gary R.
C229: VOTERS | D229: VOTED | F229: BAYS | G229: DAY | H229: BURRS | I229: SWAYZE | J229: SIMMONS | K229: FOSTER | L229: COLE, SR. | M229: GRAHAM | N229: WHITE, JR. | O229: GRAHAM
F230: Democratic 6A | G230: Republcian 7B | H230: Republican 8B | I230: Democratic 9A | J230: Republican 9B | K230: Independence 9C | L230: Democratic 10A | M230: Republican 10B | N230: Democratic 11A | O230: Republican 11B
A231: SMYRNA 1 | C231: 723 | D231: 360 | F231: 198 | G231: 261 | H231: 223 | I231: 118 | J231: 196 | K231: 68 | L231: 110 | M231: 166 | N231: 87 | O231: 243
A233: TOTAL | C233: =SUM(C234:C236) -> 723 | D233: =SUM(D234:D236) -> 360 | F233: =SUM(F233:F235) -> 198 | G233: =SUM(G233:G235) -> 261 | H233: =SUM(H233:H235) -> 223 | I233: =SUM(I233:I235) -> 118 | J233: =SUM(J233:J235) -> 196 | K233: =SUM(K233:K235) -> 68 | L233: =SUM(L233:L235) -> 110 | M233: =SUM(M233:M235) -> 166 | N233: =SUM(N233:N235) -> 87 | O233: =SUM(O233:O235) -> 243