A6: CHENANGO COUNTY | E6: OFFICIAL ELECTION RESULTS
A8: GENERAL ELECTION NOVEMBER 2, 2010
A10: TOWN OF LINCKLAEN - JUSTICE
B12: 2010 REG | C12: Total | E12: Justin W. | F12: WRITE-IN | G12: BLANKS | H12: VOID | I12: TOTAL
B13: VOTERS | C13: Votes | E13: Rice
E14: Republican
A15: TOWN OF LINCKLAEN
A16: LINCKLAEN 1 | B16: 236 | C16: 121 | E16: 97 | F16: 2 | G16: 22 | H16: 0 | I16: =SUM(E14:H14) -> 121
A18: TOTAL | B18: 236 | C18: 121 | E18: 97 | F18: 2 | G18: 22 | H18: .. | I18: =SUM(E16:H16) -> 121
A20: TOWN OF MCDONOUGH - PROPOSAL
B22: 2010 REG | C22: Total | E22: YES | G22: NO | H22: BLANKS | I22: VOID | J22: TOTAL
B23: VOTERS | C23: Votes
A24: MCDONOUGH 1 | B24: 569 | C24: 288 | E24: 89 | G24: 190 | H24: 9 | I24: 0 | J24: =SUM(E24:I24) -> 288
A26: TOTAL | B26: 569 | C26: 288 | E26: 89 | G26: 190 | H26: 9 | I26: 0 | J26: =SUM(E26:I26) -> 288
A30: TOWN OF OTSELIC - TOWN CLERK TO FILL VACANCY
B32: 2010 REG | C32: Total | E32: Nika M. | F32: WRITE-IN | G32: BLANKS | H32: VOID | I32: TOTAL
B33: VOTERS | C33: Votes | E33: COLE
E34: Democratic
A35: TOWN OF OTSELIC
A36: OTSELIC 1 | B36: 580 | C36: 267 | E36: 200 | F36: 1 | G36: 66 | H36: 0 | I36: =SUM(E36:H36) -> 267
A38: TOTAL | B38: 580 | C38: 267 | E38: 200 | F38: 1 | G38: 66 | H38: =SUM(H36) -> 0 | I38: 267
A40: TOWN OF SMYRNA- TSUPERINTENDENT OF HIGHWAYS TO FILL VACANCY
B42: 2010 REG | C42: Total | E42: Robert D. | F42: WRITE-IN | G42: BLANKS | H42: VOID | I42: TOTAL
B43: VOTERS | C43: Votes | E43: GRAHAM
E44: Democratic
A45: TOWN OF SMYRNA
A46: SMYRNA 1 | B46: 732 | C46: 380 | E46: 274 | F46: 32 | G46: 74 | H46: 0 | I46: =SUM(E48:H48) -> 380
A48: TOTAL | B48: 732 | C48: 380 | E48: 274 | F48: 32 | G48: 74 | H48: =SUM(H48) -> 0 | I48: =SUM(I48:I49) -> 380