A1: OFFICIAL RESULTS | F1: CHENANGO COUNTY
F2: OFFICIAL RESULTS
F3: November 8, 2011 General Election
D6: SUPERVISOR | F6: TOWN CLERK | H6: JUSTICE | I6: COUNCILMAN | K6: COUNCILMAN TO FILL VACANCY
D7: Ross | F7: Mary B. | H7: Joseph G. | I7: Roy R. | J7: Roger P. | K7: C. Paul | L7: Kim N.
A8: TOWN | B8: REG. | C8: TOTAL | D8: IANNELLO | F8: BROWN | H8: Brillinger Jr. | I8: Stockwell | J8: Foote | K8: THOMSEN | L8: FELTER-CANARELLI
A9: NEW BERLIN | B9: VOTERS | C9: VOTED | D9: 2H | F9: 3B | H9: 4B | I9: 5B | J9: 6B | K9: 7E | L9: 7G
D10: Open Door | F10: Republican | H10: Republican | I10: Republican | J10: Republican | K10: Independence | L10: Keep Water Safe
A12: TOTAL | B12: 1414 | C12: 223 | D12: 168 | F12: 184 | H12: 177 | I12: 178 | J12: 184 | K12: 137 | L12: 57
J14: SUPERINTENDENT
D15: SUPERVISOR | F15: TOWN CLERK | H15: COUNCILMAN | J15: OF HIGHWAYS
D16: Robert E. | F16: Loretta L. | H16: Penny M. | I16: Linda K. | J16: Albert B.
A17: TOWN | B17: REG. | C17: TOTAL | D17: WANSOR | F17: SMITH | H17: FITZPATRICK | I17: SEYMOUR | J17: ROUNDS
A18: NORTH NORWICH | B18: VOTERS | C18: VOTED | D18: 2B | F18: 3B | H18: 4B | I18: 6B | J18: 6B
D19: Republican | F19: Republican | H19: Republican | I19: Republican | J19: Republican
A21: TOTAL | B21: 987 | C21: 135 | D21: 126 | F21: 128 | H21: 120 | I21: 125 | J21: 128
M22: SUPERINTENDENT
D23: SUPERVISOR | F23: TOWN CLERK | H23: JUSTICE | I23: COUNCILMAN | K23: ASSESSOR | M23: OF HIGHWAYS | N23: TAX COLLECTOR
D24: David C. | F24: Martha L. | H24: James A. | I24: Charles W. | J24: Milton H. | K24: David R. | L24: Mark A. | M24: Ronald G. | N24: Barbara E.
A25: TOWN | B25: REG. | C25: TOTAL | D25: LAW | F25: VIDLER | H25: FOX | I25: BROOKS | J25: SHEPLER | K25: ADAMS | L25: DOLIVER | M25: WHALEY | N25: ANNESI
A26: NORWICH | B26: VOTERS | C26: VOTED | D26: 2B | F26: 3B | H26: 4B | I26: 5B | J26: 6B | K26: 7B | L26: 8B | M26: 9B | N26: 10B
D27: Republican | F27: Republican | H27: Republican | I27: Republican | J27: Republican | K27: Republican | L27: Republican | M27: Republican | N27: Republican
A28: DISTRICT 1 | B28: 761 | C28: 69 | D28: 57 | F28: 65 | H28: 59 | I28: 60 | J28: 58 | K28: 53 | L28: 61 | M28: 64 | N28: 63
A29: DISTRICT 2 | B29: 587 | C29: 69 | D29: 55 | F29: 59 | H29: 57 | I29: 60 | J29: 56 | K29: 56 | L29: 62 | M29: 55 | N29: 63
A30: DISTRICT 3 | B30: 878 | C30: 82 | D30: 75 | F30: 70 | H30: 73 | I30: 73 | J30: 66 | K30: 65 | L30: 66 | M30: 69 | N30: 75
A31: TOTAL | B31: =SUM(B25:B30) -> 2226 | C31: =SUM(C25:C30) -> 220 | D31: =SUM(D25:D30) -> 187 | F31: =SUM(F25:F30) -> 194 | H31: =SUM(H25:H30) -> 189 | I31: =SUM(I25:I30) -> 193 | J31: =SUM(J25:J30) -> 180 | K31: =SUM(K25:K30) -> 174 | L31: =SUM(L25:L30) -> 189 | M31: =SUM(M25:M30) -> 188 | N31: =SUM(N26:N30) -> 201
D33: CITY COURT JUDGE | F33: MAYOR | H33: SUPERVISOR | I33: SUPERVISOR | J33: SUPERVISOR | K33: SUPERVISOR | L33: ALDERMAN | M33: ALDERMAN | N33: ALDERMAN
A34: CITY OF | B34: REG. | C34: TOTAL | D34: James E. | F34: Joseph P. | H34: WARD 1-2-3 | I34: WARD 1-2-3 | J34: WARD 4-5-6 | K34: WARD 4-5-6 | L34: WARD 1 | M34: WARD 3 | N34: WARD 5
A35: NORWICH | B35: VOTERS | C35: VOTED | D35: DOWNEY | F35: MAIURANO | H35: James J. | I35: James J. | J35: Linda E. | K35: Robert M. | L35: Robert M. | M35: John F. | N35: Paul J.
D36: 2B | F36: 2B | H36: MCNEIL | I36: MCNEIL | J36: NATOLI | K36: JEFFREY | L36: CAREY | M36: DEIERLEIN | N36: LAUGHLIN
D37: Republcian | F37: Republican | H37: 4A | I37: 4G | J37: 4B | K37: 4G | L37: 5B | M37: 5B | N37: 5B
H38: Democratic | I38: Quality of Life | J38: Republcian | K38: Time For A Change | L38: Republican | M38: Republican | N38: Republican
A39: WARD 1 | B39: 701 | C39: 104 | D39: 85 | F39: 70 | H39: 82 | I39: 6 | L39: 78
A40: WARD 2 | B40: 585 | C40: 117 | D40: 99 | F40: 91 | H40: 86 | I40: 14
A41: WARD 3 | B41: 769 | C41: 152 | D41: 132 | F41: 125 | H41: 109 | I41: 21 | M41: 122
A42: WARD 4 | B42: 449 | C42: 82 | D42: 67 | F42: 63 | J42: 40 | K42: 42
A43: WARD 5 | B43: 545 | C43: 118 | D43: 95 | F43: 97 | J43: 50 | K43: 62 | N43: 91
A44: WARD 6 | B44: 586 | C44: 165 | D44: 143 | F44: 138 | J44: 57 | K44: 107
A45: TOTAL | B45: =SUM(B39:B44) -> 3635 | C45: =SUM(C39:C44) -> 738 | D45: =SUM(D39:D44) -> 621 | F45: =SUM(F39:F44) -> 584 | H45: =SUM(H39:H44) -> 277 | I45: =SUM(I39:I44) -> 41 | J45: =SUM(J39:J44) -> 147 | K45: =SUM(K42:K44) -> 211 | M45: =SUM(M39:M44) -> 122 | N45: =SUM(N39:N44) -> 91